searchSlur,Slur,Represents,Reason
exampleslur,Example Slur,Everyone,This is an example reason for why this slur is offensive.
10%off,10% Off,Jews,Refers to circumcision and consumerism (never pay retail). The term is most widely used in the UK where circumcision among non-Jews or non-Muslims is more rare but in the United States where it is more common it can be considered insulting to many non-Jewish males as well.
51ststater,51st Stater,Canadians,Canada is so culturally similar to the U. S. that they are practically the 51st state
539,539,Jews,Corresponds with the letters J-E-W on a telephone.
7-11,7-11,Arabs,Work at menial jobs like 7-11 clerks.
8mile,8 Mile,Whites,When white kids try to act ghetto or black. From the 2002 movie 8 Mile.
925,925,Blacks,Police Code in Suburban LA for Suspicious Person
aa,AA,Blacks,African American. Could also refer to double-A batteries which you use for a while then throw away.
abba-dabba,Abba-Dabba,Arabs,Used in the movie Betrayed by rural American hate group.
abc,ABC,Australians,Aboriginals use it to offend white australians it means Aboriginal Bum Cleaner
abcd,ABCD,Indians,Means American Born Confused Desi (pronounced day-see). Used by Indians to describe American-born Indians who are confused about their culture. (Desi is slang for an 'countryman'). Also BBCD - British Born Confused Desi.
abco,Abco,Australian Aboriginals,Aboriginals being alcoholics
abdul,Abdul,Arabs,Common name.
abeed,Abeed,Blacks,Arabic term that means Black many Middle Eastern immigrants to the United States use this
abi-dabi,Abi-Dabi,Arabs,A mispronunciation of the capitol city of The United Arab Emarites which is Abu-Dhabi
aceofspades,Ace Of Spades,Blacks,Self Explanatory
adolf,Adolf,Germans,Hitler of course. Generally thought of the worst person ever.
african't,African't,Blacks,Unemployed/lazy Blacks
africoon,Africoon,Blacks,Combination of African and Coon.
afro,Afro,Blacks,Referring to hairstyle
afro-saxon,Afro-Saxon,Whites,Young white men who act black.
agentorange,Agent Orange,Vietnamese,Agent Orange was a defoliant used in Vietnam.
ahab,Ahab,Arabs,From the song Ahab the A-rab
aibu,Aibu,Whites,Nigerian word for White people. Pronounced Oyee-bo.  Not necessarily a slur nor derogatory but rather a direct translation.
ainu,Ainu,Japanese Aboriginals,Originally a word for the native Japanese islanders from Hokkaido but now means roughly a primitive person. Usually look more European than their Japanese counterparts i.e. more hairy and fair skinned. Not really derogatory.
akata,Akata,Black Americans,West African (Yoruba) term for African-Americans. Meaning ancestors of slaves or cotton picker.
aladdin,Aladdin,Arabs,One Thousand and One Nights
albino,Albino,Whites,Albinos are white.
albo,Albo,Albanians,Self Explanatory
alcoholic,Alcoholic,Native Americans,Known to have a hard time handling their liquor.
alphabet,Alphabet,Arabs,Many names seem to use every letter of the alphabet.
ame-koh,Ame-koh,Americans,Term for Americans used by Japanese.
american't,American't,Americans,Americans are stereotypically lazy.
americoon,Americoon,Blacks,Combination of American and Coon.
americunt,Americunt,Americans,Self Explanatory
amerikkkan,AmeriKKKan,Americans,Reference to inherent racism in US society. Entered the language as a part 1960s counter-cultural slang.
amerikos,Amerikos,Americans,Russian deragatory term for a dumb American
amf,AMF,Jews,Short for Arbeit Macht Frei (Work Brings Freedom) which was on the gates of the concentration camp Auswitz
ami,Ami,Americans,This is just a German abbreviation.  By itself it is not derogatory. Scheiss-Ami = Shit American obviously derogatory.
amigo,Amigo,Hispanics,Self-explanatory.
anchorbaby,Anchor Baby,Mexicans,Children of parents who crossed the border illegally; A reference to their adulthood. At that time they will be able to become the family anchor to legally bring in the rest of the family.
ancientchinesesecret,Ancient Chinese Secret,Chinese,From a 1970s TV commercial for Calgon stereotyping all laundry services are run by Chinese immigrants ( link )
angie,Angie,Canadians,English-speaking Canadians. Short for Anglophone and used in Quebec especially for Anglophones in Quebec province itself.  Also: Anglo
anglo,Anglo,Whites,A term used by Mexicans and other non whites in Texas to describe whites in a derogatory fashion.
angus,Angus,Blacks,Angus are a black breed of beef cattle.
ant,Ant,Antarcticans,Self-explanatory.
antiquefarmequipment,Antique Farm Equipment,Blacks,Slaves being used for labor.
apna,Apna,Indians,Hindi/Punjabi slang meaning our guy and referring to a male of their own race. Apni refers to Indian females. Used in areas of Punjabi immigrants.
apu,Apu,Indians,Hindu character from The Simpsons. Before that one of the most famous films out of India was the Apu Trilogy.
ararat,Ararat,Armenians,Mount Ararat is the tallest peak in Armenia and it is said that Noah's Ark landed on it during the great flood. Ararat is in historic Armenian but the region currently belongs to Turkey
aravi,Aravi,Arabs,Hebrew word for arabs
arf,Arf,Blacks,African Rock Fish. Jones Beach (NYC) term for Blacks due to their poor swimming abilities.
argie,Argie,Argentinans,Self-explanatory
armo,Armo,Armenians,Short for Armenian.
aryan,Aryan,Whites,The name Hitler used to refer to his blonde-haired blue-eyed Master Race.  Can be used towards racist whites who don't think they're racist.
ashy,Ashy,Blacks,When their skin gets dry it can tend to look ashy.
atta,Atta,Arabs,Taken from the 9/11 terrorist who flew a plane into the World Trade Center Mohammed Atta
auntjemima,Aunt Jemima,Blacks,After the stereotypically Black trademark picture on Aunt Jemima brand breakfast foods.
ayatollah,Ayatollah,Persians,A religious leader amongst Shiite Muslims. More specifically it would refer to Iranians.
azn,Azn,Asians,Asians that spend too much time online and hence use l33t the hacker language
babar,Babar,Indians,From the character Babar the Elephant. First appeared in the book Babar the King published in 1963 and made into a popular animated HBO show in the early 90's. It's about an Indian elephant character growing up.
baboomba,Baboomba,Blacks,From the booming of their car stereos.
baboon,Baboon,Blacks,Another simian reference
babu,Babu,Indians,Means child in Hindi. Getting multiple definitions for this word.
baby-muncher,Baby-Muncher,Chinese,The Chinese ate their babies because of their poverty stricken homes and to keep down the population.
bacardi,Bacardi,Puerto Ricans,Bacardi - Puerto Rican Rum
baconbits,Bacon Bits,Whites,White Trailer Trash that have sex with Pigs
bagel-dog,Bagel-Dog,Jews,From Kosher bagel dogs - a Kosher sausage inside of a bagel.
bahadur,Bahadur,Nepalese,Bahadur means brave has become a derogatory term for Nepali servants. They are also called Gaurkhs.
baitou,Bai Tou,Whites,Mandarin Chinese term meaning white head.
baijo,Baijo,Whites,Japanese term meaing strangers used in a hostile way.
bakguiy,Bak Guiy,Whites,Cantonese for white ghost.
balsero,Balsero,Cubans,Spanish for rafter
baluba,Baluba,Blacks,Name belonging to a tribe that killed Irish soldiers in Africa.
baluga,Baluga,Blacks,Filipino equiv. to Nigger known by all Filipinos
bamboocoon,Bamboo Coon,Chinese,Bamboo grows in China.
banana,Banana,Asians,An Asian American who has lost their heritage. Yellow on the outside white on the inside.
bananabender,Banana Bender,Australians,Austrlian slang term for a useless person living in the state of Queensland.
bananame,Bananame,Asians,Banana and anime. Refers to Asians esp. Filipinos who are fixated on Japanese pop culture(anime music etc.) only date Japanese try to be Japanese.
bandwidthnigger/whore,Bandwidth Nigger/Whore,Asians,Represents Asians who instead of using the Asian video game servers they are assigned jump to a US server and hog the bandwidth of US users.
banjolips,Banjo Lips,Blacks,Big lips
bantu,Bantu,Blacks,Comes from the apartheid racial classification for Blacks. Rarely used today. Derogatory
bap,BAP,Blacks,Means Black American Princess. Arrogant female blacks who flaunt their money around and demand the finest things in life.
barcode,Bar Code,Jews,Jewish prisoners were tattooed with a number on their arm while in concentration camps. While the bar code was not invented(or at least patended) until after the war this is a slur in common although incorrect usage.
bara,Bara,Arabs,Arab spelled backwards.
bargainkorean,Bargain Korean,Hawaiians,Hawaiians are sometimes confused for asian but are not quite right.
bat-gwai/bai-guei,Bat-gwai/Bai-guei,Whites,Bat-gwai is the Cantonese for white ghost; or as we more commonly hear it translated white devil. It may be worth noting that white is the color of death and mourning in China as black is in Europe and America.
batman,Batman,Arabs,Women of the Islamic faith who wear a cape(loosely) and mask similar to that of Batman.
bayfrog,Bay Frog,Canadians,Hudson Bay + Frog. Specifically refers to French descendents from Quebec
bazi,Bazi,Germans,Bazi is a Bavarian/Southern German term for a loveable crook.  Pronounced baht-see
bbk,BBK,Blacks,Big Black Cocks. Spelled with a K as in the Korn song of the same title.
bdn,BDN,Blacks,Big Dummy Nigger Comes from the movie The Green Mile. A white prisoner calls a black prisoner a Big Dummy Nigger.
beach-nigger,Beach-Nigger,Whites,Overly-tanned people/surfers.
beanbandit,Bean Bandit,Hispanics,They eat beans.
beanburrito,Bean Burrito,Hispanics,Common Hispanic food is bean burritos and the coloring of the beans is similar to the coloring of their skin.
beandipper,Bean Dipper,Whites,White men or any non-hispanic who date hispanic women.
beanbag,Beanbag,Hispanics,Another slur based on the Hispanics consumption of beans
beaner,Beaner,Hispanics,Because they are known to have a lot of beans in their diet and are also hired many times to pick beans for (sometimes less than) minimum wage.
beanerball,Beaner Ball,Hispanics,Soccer is quite popular in Mexico and South America.
beanershnitzel,Beaner Shnitzel,Mixed Races,German/Hispanic mix
beaniard,Beaniard,Hispanics,Refers to the Spanish origin Spaniard mixed Bean with a commom food in many Mexican dishes.
beanie,Beanie,Jews,Referring to the yarmulke.
bear,Bear,Blacks,Black Educated And Rich
beastieboy,Beastie Boy,Jews,Jews who act Black like the Jewish rap group The Beastie Boys.
beaver-beater,Beaver-Beater,French Canadians,Fur trade.
bebe'skids,Bebe's Kids,Blacks,Reference to a stand up comic's famous bit about Bebe's kids that inspired a movie years later.
bedtime,Bed Time,Asians,Reference to their eyes.
bee-keeper,Bee-Keeper,Afghans,Because Arab women are clothed from head to toe even their faces and they look like bee keepers.
beecher,Beecher,Whites,For white people who kowtow to Black people or racist White People. Derived from the show Oz on HBO where the character Beecher was raped and sodomized by Blacks and Racist whites.
beggar,Beggar,Blacks,Black people often want something for nothing.
belegana,Belegana,Whites,Navajo term which roughly translates to silly white person
belgie,Belgie,Belgians,Shortening of word
bennie,Bennie,Falkland Islanders,The Islanders were named after a less than academically gifted character (Benny) in a mediocre British TV soap (Crossroads) by British troops stationed on the Islands after the failed Argentinian invasion.
bergie,Bergie,Blacks,Originally referring to the primarily coloured hobos who live on Table Mountain near Cape Town.
berrypicker,Berry Picker,Hispanics,Refers to Hispanics who would work berry fields in California specifically illegal immigrants as their employer didn't have to pay them as much.
bet,BET,Blacks,Black Entertainment Television
betty,Betty,Vietnamese,Bouncing Bettys in Vietnam War
bettycrocker,Betty Crocker,Whites,Refers to white women in general
beur,Beur,Arabs,Verlan (French slang) for reube which is itself verlan for Arabe. Usually used for children of migrants from Maghreb settled in France in the 60-70's. Not inherently derogatory.
bfi,BFI,Native Americans,The Big Fucking Indian at the back of the bar you dont want to piss off.
bfi,BFI,Blacks,BFI the name of a waste disposal company is on the side of their dumpsters. Stands for Black Family Inside.
bhindu,Bhindu,Indians,Similar to hillbilly or simpleton. Bindu is a Sanskrit word meaning drop. The word bindi which is the typical red dot worn on the forehead of Indian men and women comes from this word.
bhrempti,Bhrempti,Indians,Their pronunciation of the number 20.
bible-shortener,Bible-Shortener,Jews,Seen on a Conan O'Brien sketch Rednecks' Favorite Euphemisms for Jews backwards refers to the difference between the Christian Bible and the Jewish one.   The Christian Bible includes the New Testament whereas the Jewish Bible does not.
bic-needer,Bic-Needer,French,Most likely because French women don't tend to shave there arm pits and legs.
bigmac,Big Mac,Scottish,A large Scottish man.
bignose,Big Nose,Jews,Refers to how Jews are said to have large noses.
bignose,Big Nose,Whites,Term used by Asians when refering to westerners because of their larger noses
bigred,Big Red,Native Americans,A fat native person. Refference to the gum with the same name.
billyreuben,Billy Reuben,Blacks,The pigment that makes feces brown is called bilirubin
binladen,Bin Laden,Arabs,Self-explanatory
binder,Binder,Indians,slang for turbin
bindi,Bindi,Indians,From the dot that Hindu women wear on their foreheads.
bingo,Bingo,Bengalis,Derogatory used by Indians and Pakistanis
bingo-bongo,Bingo-Bongo,Blacks,Italian wordplay of African names/language
bink,Bink,Mixed Races,Black/Chinese Mix. Black person with Chinese or Chink blood
bipty,Bipty,Indians,When an Indian gives you change at 7-11 they sound like they're saying Here is one dollar and bipty cents.
birdshit,Bird Shit,Whites,Because bird shit is mainly white
birdturd,Bird Turd,Whites,Bird shit is white.
biscuithead,Biscuit Head,Koreans,KATUSAS - Koreans augmented to the United States Army commonly referred to as Biscuit Heads by American GI's because of their square heads.
biscuitlip,Biscuit Lip,Blacks,Reference to large lips.
bixnood,Bix Nood,Blacks,From a racist cartoon spread on the internet where a black man is breaking into a house saying mup da doo ditta po mo BIX NOOD
bjork,Bjork,Icelanders,She's the Icelander everyone knows.
blackbarbie,Black Barbie,Blacks,Refers to a black woman when she wears her hair and makeup to try and look like a white woman.
blackbean,Black Bean,Mixed Races,Mexican/Black. Self Explanitory
blackdagos,Black Dagos,Italians,Believed that some Sicilians are part Black.
blackmagic,Black Magic,Blacks,It has always fascinated researchers how the black folk manage to get there hands on grog money daily. Specific words of the original submitter of which I am fascinated by.
blacktime,Black Time,Blacks,Perceived tendency for Blacks to be late
blackanese,Blackanese,Mixed Races,Black/Asian mix; from a line by Chris Tucker in Rush Hour 2
blackfoot,Blackfoot,French,Possible reference to French-Indian War and/or WW1 and the general sense of French cowardess during wars. Since they had no boots due to the trenches eating them away when they ran their feet became all covered in mud. Or French born in North Africa.
blackhead,Blackhead,Turkish,Turkish workers in Europe are degraded because of their darker hair color than German races.
blackie,Blackie,Blacks,Self-explanatory.
blackout,Blackout,Native Americans,A stereo type of American Indians referencing their prevalence to excessive alcohol consumption.
blackrobe,Blackrobe,Whites,White Missionaries. Native American term.
blackychan,Blacky Chan,Blacks,Blacks who practice martial arts
blanco,Blanco,Whites,Blanco' is Spanish for white or blank.
blanket-ass,Blanket-Ass,Native Americans,From when the US Government gave tribes blankets.. I guess to make up for killing so many of them. The blankets were also rumored to be infested with smallpox.
blaxican,Blaxican,Mixed Races,Black/Mexican mix. Pioneered by the Black/Mexican hip-hop group Delinquent Habits.
bleachboy,Bleach Boy,Whites,Because bleach whitens things
bleck,Bleck,Blacks,Sounds like the word black said with a South African accent. http://imdb.com/title/tt0097733/
blockhoppers,Block Hoppers,Puerto Ricans,Because so many Puerto Ricans live in Apartment Block to Apartment Block
blockbuster,Blockbuster,Blacks,A real estate agent who sells a home in an upper-class white neighborhood to a black family thus lowering the values of other homes in the neighborhood. (This can be stretched to include inviting a black or minority friend over for dinner.)
blockhead,Blockhead,Germans,Refers to the shape of their heads.  Term dates back to the beginning of time.  Used a lot by Charles M. Schulz in The Peanuts comics & cartoons.
blockhead,Blockhead,Macedonians,Shape of their heads; Australian.
bloke,Bloke,British,Used by french canadians to identify english speaking people
blood,Blood,Blacks,LA-based gang. Can be used offensively towards non-gang members.
bloodsucker,Blood Sucker,Romanians,Dracula was a Romanian
blow,Blow,Blacks,Originated from blacks originally living in Africa and using blow guns.
blowfish,Blowfish,Whites,From the pop band Hootie and the Blowfish. The lead singer was black (Hootie) the band was white (The Blowfish).
blt,BLT,Blacks,Big-Lipped Tyrone or for female version Big-Lipped Tyreesha. Inspired from the 80's version of Degrassi Jr. High where the black guy wore a shirt with the phrase BLT his initials.
bludger,Bludger,Australian Aboriginals,A bludger or more accurately dole-bludger in Australian slang is someone who doesnt work and relies on the government for money (doles). It is the sterotype that all the Mediterraneans and Aborigianals of Australia are bludgers.
bluecollar,Blue collar,Mexicans,Many illegal immigrants take manual labor jobs.
bluegums,Blue Gums,Blacks,Old myth that if one were bitten by a nigger with blue gums they would die.
blue-eyeddevil,Blue-Eyed Devil,Whites,Whites primarily with blue eyes are said to be the most evil. Especially since their skin is so pale it looks scary to others as their blue eyes stare out at them.
bo-bo,Bo-Bo,Blacks,Sounds like a monkeys name or implies stupidty.
boatrower,Boat Rower,Cubans,Many people from Cuba attempt to sneak into the United States via rafts and boats.
bobblehead,Bobblehead,Blacks,Black women have a tendency to violently shake their heads in heated conversations.
boche,Boche,Germans,The French called the Germans this in WWII. Boche is short for alcaboche or cabbage-head.
bodinki,Bodinki,Puerto Ricans,Slur used by Portuguse in Hawaii
boffer/boofer,Boffer/Boofer,Blacks,The Hawaiians or Polynesians call Blacks this name. Same as nigger in the United States.
bog-jumper,Bog-Jumper,Irish,Many bogs in Ireland
bog-trotter,Bog-trotter,Irish,Abundance of bogs in Ireland
bogan,Bogan,Australians,New Zealand/Australian white trash or rednecks. Appearance : Typically clad in black rib jersey (Hallensteins $49.95)black jeans and a shredded black heavy-metal t-shirt. Clothing with beerlogos is an acceptable alternative to above - Waikato is favourite. Blackoil stains on skin optional. A curious feature is the haircut whichalthough short(ish) at the front and sides is long and straggly at theback. The cover thus provided enables one to distinguish the bogan fromthe redndeck . Habitat : The beach in summer but only those with free road access. MtMaunganui provides a typical bogan haunt. Despite the heat bogans NEVERexpose their torsos even when swimming. Science has yet to explain whythey refuse to shed their protective coating of black fabric. Bogans maybe found at all times on back roads at rugby matches and in public bars.If you can't see a bogan straight away they may be shy - try watching theolder Holden Kingswoods for activity. Feeding : Copious quantities of beer provide all the nourishment a Boganrequires. Reproduction : Bogans appear to be exclusively male. Females are activelyrepelled by cries of getchagearsoff or showusyagrowler if they dareventure too close. Like geeks rugbyheads and best friends of populargirls the Bogan is the non-viable offspring of apparently fertilehumans. Seldom seen in numbers fewer than three. Source: NZ.com & UD
bohunk,Bohunk,Hungarians,May be a contraction of 'Bohemian/Hungarian' and might refer to Hungarians Czechs and Ukrainians (As well as Russians).  Possibly of Slavic origin. See: Honky.
bolillo,Bolillo,Whites,Mexicans use it to refer to white people: bolillo=white bread bun
bolita,Bolita,Bolivian,Argentines refer to the poorer Bolivian immigrants who live in Argentina as bolitas. It means small balls in Spanish.
bologna,Bologna,Italians,Reference to Bologna Italy
bomb,Bomb,Blacks,Bombs in cartoons are typically black
bombwatcher,Bomb Watcher,Japanese,Refers to atom bombs the US dropped on Hiroshima and Nagasaki in WWII.
bomb-builder,Bomb-Builder,Arabs,Many terrorists nowadays are Arabs.
bones,Bones,Jews,Reference to the holocaust when Jews were often worked so hard they were turned into a mere pile of bones.
bonky,Bonky,Blacks,Name for blacks who act or talk white
boogalee,Boogalee,Cajuns,May be a corruption of the French slang for feces.
boogat,Boogat,Blacks,Comes from the similar idea of calling a black person a Spook. C. 1940s
boogie,Boogie,Blacks,Referring to Boogie Woogie form of jazz? Could come from W. African Buuker or Buckra meaning Devil Boogie man or White Man. Turned around and used against Blacks by Whites.
boogieman,Boogie Man,Whites,Enslaved African-Americans told tales to their children of a Boogie Man who would abduct you kill you or otherwise cause harm to you if you were to leave the plantation. The Boogie man of which they spoke was in essence the white man. (Possible connection tot the ghost like appearance of the KKK)
boojie,Boojie,Indians,Pronounced 'boo-jee'; refers to all the 7-11 workers of the world.
boomer,Boomer,Australian Aboriginals,They use boomerangs
boon,Boon,Blacks,Probably a derivation of Baboon or the black Boon Bug beetle.
booner,Booner,Australian,Canberra word for bogan. Sometimes shortened too boon.
boong,Boong,Australian Aboriginals,Origin: Boonga is a native word from the Sydney area pre-1788 meaning anus.
boori,Boori,Australian Aboriginals,Same As Abo Coon Boong Moorindachi Pikinini.
bootlip,Bootlip,Blacks,During the Industrial boom of the auto industry and OSHA'a requirement of safety precautions workers were required to wear steel-toed boots.  Common steel-toed boots are black in color and have large bulky toes - referencing the size of black's lips.
borderbandit,Border Bandit,Mexicans,A Mexican who has crossed the border illegally. Also a BB
borderbunny,Border Bunny,Hispanics,Hopping the border to get into America.
bordernigger,Border Nigger,Hispanics,See Border Bunny.
border-hopper,Border-Hopper,Hispanics,Same as Border Bunny. Border-Jumper too.
bosants,Bosants,Bosnians,A non derogatory name of themselves bosanats turned derogatory in Slovenia a word bos also means barefoot many Bosnians are muslim and walk barefoot around the house mosque etc.
bosch,Bosch,Germans,French WW2 term. Name of a big german tool and machine producer?
boskur,Boskur,Bosnians,a mix of Bosnian and chefur used derogatory in Slovenia typically hard uneducated workers from Bosnia and Hercegovina
boss,Boss,Whites,Commonly used by American minority groups (blacks hispanics asians) to refer to white people.
boudreaux,Boudreaux,Cajuns,Common name among Cajuns.
bountybar,Bounty Bar,Blacks,The Bounty Bar is a coconut filled chocolate bar so it's brown on the outside but white on the inside.  An insult to (for example) black police officers in England.
bourbon,Bourbon,Blacks,Bourbon are brown coloured brown cream filled biscuits. Possibly a variant of eggplant. Bourbon is also a dark alchoholic drink
bowbender,Bow Bender,Native Americans,Indians shot bows.
boxcutter,Boxcutter,Arabs,September 11th
boxhead,Boxhead,Germans,Germans typically have or are thought to have rather square heads.
boy,Boy,Blacks,Originated during slavery. Used to belittle blacks.
bozak,Bozak,Blacks,Pronounced (bow-zack) southern term for a big black man.  thats one black bozak
bozgor,Bozgor,Hungarians,Term used in Eastern Europe for Hungarian-Ethnics living in different countries after WWI. It means man without country or just imitates Hungarian talking.
bracero,Bracero,Mexicans,Spanish term for a Mexican migrant worker
brady,Brady,Whites,From TV show The Brady Bunch especially used to make the point that whites are acting uncool. A variation is to refer to someone by the names of one of the Brady Bunch childreni.e. Peter Marsha etc.
branchmanager,Branch Manager,Blacks,Monkeys climb trees.
brassankle,Brass Ankle,Mixed Races,Refers to a person of black and white heritage who passes for a white person. Unsure of origins.
brazuca,Brazuca,Brazilians,Does not necessarily bear a negative connotation. It is used by Brazilians most often when depicting Brazilian athletes playing abroad.
brew,Brew,Jews,Short for Hebrew.
briar,Briar,Whites,Term probably comes from the briar bushes found in Appalachian states. Variant: briar-hopper. Applied locally to redneck Kentucky native or other southerner from Appalachia who resettled in Southwestern Ohio during or after WWII in search of factory jobs.
brillopad,Brillo Pad,Blacks,Hair reminiscent of a Brillo Pad.
brit,Brit,British,Short for British. Used as in Brits Out!: graffiti from Ireland.
bro,Bro,Blacks,Contraction of brother see: Brother.
bro-ho,Bro-ho,Whites,A white woman who dates or has sex with black men. Bro = black man. Ho = short for whore.
bronxindian,Bronx Indian,Jews,Probably not derogatory possibly self-referential. Most likely from sometime between the turn of the century and the early sixties. I have only found one reference to it but I believe it is most likely from the fact that in the first half of the twentieth century for a period almost fifty percent of the Bronx was Jewish thus they were seemingly like the native population of the Bronx.
