searchSlur,Slur,Represents,Reason
conquistador,Conquistador,Blacks,Refers to the Spanish conquerors who took over areas against the will of the current inhabitants.
convict,Convict,Blacks,Two-thirds of American inmates are Black.
convict,Convict,Australians,Implies that all Australians are descended from the penal colonies early in Australia's western colonisation.
cook,Cook,Asians,Most Asians in non-asian countries are cooks.
cookie,Cookie,Chinese,Refers to fortune cookies. 'Cookie person/people.'
cookie,Cookie,Blacks,One of the few jobs blacks were allowed to do after enlisting in the U.S. Navy was food preparation. Referenced in Men of Honor.
cookies'ncream,Cookies 'n Cream,Mixed Races,Black/White
coolie,Coolie,Asians,Term for unskilled Chinese workers especially on U.S. railroads.
coon,Coon,Blacks,Probably refers to the Portuguese word for slave pens or barracks baracoons. Could also have meaning as a shortening of raccoon as raccoons have a tendency to steal. Possibly from Dr. Carleton Coon who in the mid-1960's theorized that blacks were less evolved than whites.
coonadian,Coonadian,Blacks,Black people from Canada
coonass,Coonass,Cajuns,The origin of the term is said to have come from the French word conasse. During the Second World War many Cajun men served in the armed forces. When in France many of the French heard the Cajuns speaking in a French that was both very old and in a French that had some very odd words. The Frenchmen called the Cajuns conasse which translates to a very low-grade prostitute. I would think this comes from the fact that although they spoke a form of French the Cajuns weren't real Frenchmen. Another theory has it originating in South Louisiana derived from the belief that Cajuns frequently ate raccoons.
cooner,Cooner,Blacks,Black actor who sells out to get laughs from white people.
coontang,Coontang,Blacks,Whenever a White man fucks a Black woman he gets some Coontang
cordon,Cordon,Blacks,Derivative of the name of a champagne; Cordon Negro.
corky,Corky,Whites,For kids with downs syndrome Corky on Life Goes On.
corky,Corky,Dominicans,Sammy Sosa's corked bat.
corn,Corn,Mexicans,From Mexi-Corn from Southern California reference to Mexicans picking corn or other produce.
cornbread,Cornbread,Blacks,It was in the movie Shaft. Apparently Black people like Corn Bread.
cornelius,Cornelius,Blacks,Planet Of The Apes reference.
cornfed,Cornfed,Whites,Refers to large white boys from rural areas (They are cornfed like premium cattle) Typically considered to be extremely strong but not too bright
cosby,Cosby,Blacks,Sitcom named the Cosby's. A family of all blacks.
cossak,Cossak,Russians,A slur for Russians in general
cottonball,Cotton Ball,Blacks,Nappy/frizzy hair esp. the 70's Afro style; bought to pick cotton in the Old South
cotton-picker,Cotton-Picker,Blacks,Originates from pre-Civil War US. Refers to the slaves who picked cotton all day at the plantations.
cow-kisser,Cow-Kisser,Indians,For the worship of cows in India.
cowboy-killer,Cowboy-Killer,Native Americans,They killed many a cowboy.
cowfuck,Cowfuck,Whites,Farmers in the fields getting intimate with their animals
crabrangook,Crabrangook,Chinese,Crabrangoon. Take away the goon and add gook.
cracker,Cracker,Whites,This term is said to have originated in England before the 16th century refering to the lower class whose diet primarily consisted of crackers actually biscuits. Many of their descendants were sent to the Georgia penal colony hence Georgia crackers. White people had invented this name for themselves before the first slave was brought to America although it is still in use today by mostly older blacks referring to whites.  Was probably redefined in the days of American slavery by the slavemaster's Crack of the whip.
crackerjack,Cracker Jack,Whites,Same as cracker only derived from the popcorn
crackerjap,Cracker Jap,Japanese,A person of mixed Japanese/Caucasian descent
crapaud,Crapaud,French,Originally the name of a South European frog although during the Napoleonic Wars it became a term used by British soldiers referring to their French enemy.
craw,Craw,Blacks,Fondness of CRAWdads.
crayola,Crayola,Blacks,Black people are colored as in crayons.
creamofwheat,Cream Of Wheat,Blacks,A famous black person in the world of advertising is the man on the Cream of Wheat box.
cremlin,Cremlin,Whites,White Europeans.
crickgypsy,Crick Gypsy,Whites,White trash who wander around looking for a job. In West Viginia the only navigable areas are the valleys formed by rivers and creeks(cricks).
cricket,Cricket,Blacks,Color of skin vs. cricket's color (brown/black). Pure blooded Blacks having large fish eyes dark brown skin and long legs like a cricket. Could also refer to Blacks that stay up all night playing loud thumping music real common in the industrial Midwest.
crikey,Crikey,Jews,A corrupted version of Christ Killer
crikey,Crikey,Australians,Catch phrase of Steve Irwin a famous Australian animal expert
crime,Crime,Blacks,The high crime rate among Blacks.
crimestopper,Crimestopper,Blacks,Refers to an African American woman who has an abortion
criminalfactory,Criminal Factory,Blacks,Refers to pregnant black women thought to be breeding future criminals.
crioulo,Crioulo,Blacks,Brazilian slur for black people
crisco,Crisco,Whites,Crisco is a white vegetable oil product.
crispy,Crispy,Blacks,Very dark black people are refered to as crispy
crizm,Crizm,Whites,Some sort of variant of cracker. Unsure of origins but have heard it used in Florida.
cross-dresser,Cross-Dresser,Scottish,The wearing of Kilts (like skirts)
crotchlesspants,Crotchless Pants,Koreans,Refers to some of their characters looking like crotchless pants.
crote,Crote,Croatians,Slang term for Croatians
crouton,Crouton,French,French salad dressing
crow,Crow,Blacks,Relatively large black bird.  Could also be a reference to Jim Crow a popular 19th-century minstrel song that stereotyped African Americans which later was used as the name of the Jim Crow laws  which enforced racial segregation in the South.
crow,Crow,Native Americans,Used against other then Crows. Crows were scouts for the American Military or considered tradors by other Native Americans.
crudo,Crudo,Whites,Literally Raw in Spanish
crumpet-stuffer,Crumpet-Stuffer,British,They eat crumpets with their tea.
crumpet-sucker,Crumpet-Sucker,British,They eat crumpets.
crunchy,Crunchy,Iraqis,Used by US Marines in the second Iraq war.  When the US attacked Iraq Saddam Hussein allegedly told his troops that the American tanks were made of cardboard.  So the Iraqi soldiers would jump out in front of the tanks they would make a crunching sound.
cube,Cube,Cubans,Self-Explanitory
cube,Cube,Eskimos,Referring to their igloos made of cubes
cubs,Cubs,Blacks,Look like cartoon bear cubs.
cuff,Cuff,Blacks,Heard used by white southern Georgia farmers to describe blacks. The origin is that blacks are always being arrested and being handcuffed by the police.
curb-biter,Curb-Biter,Blacks,Having someone bite the curb and kicking him in the back of the head is a painful way to kill someone.  Often as in the movie American History X it is used as punishment for insubordinate blacks.
curry,Curry,Indians,Derivative of Curry Muncher etc.
curry-muncher,Curry-Muncher,Indians,They eat Curry.
custer,Custer,Whites,Used by Native Americans. I guess it means they want to see them dead like General Custer.
cuz,Cuz,Australian Aboriginals,Form of cousin all Aboriginals consider themselves to be from the same family hence they refer to each other as cuz
cygan,Cygan,Gypsy,Polish word for Gypsy used officially but Gypsies prefer to be called Roma. Cygan is becoming unacceptable in the Polish language.
czarnuch,Czarnuch,Blacks,In Polish 'black' (as a color) is 'czarny'. Strongly derogatory.
czigger,Czigger,Mixed Races,Black Czechs
d.f.n.,D.F.N.,Blacks,Dumb Fucking Nigger
d.i.p.,D.I.P.,Indians,Dumb Idiotic Punjab
dabizi,Da Bi Zi,Whites,Used in China it means big nose. Da Bi Zi is the phonetic equivalent of tabeestu.
dagui,Da Gui,Whites,Mandarin Chinese term meaning big demon.
dago,Dago,Italians,Slang for Italian originally coming from Spain. Diego was a common name in Italy at the time this slang was first used. See: Wop.
dago,Dago,Spanish,Apparently the British use dago to describe Spaniards as opposed to Italians.
dagowop,Dagowop,Italians,Combination of two slurs.
dahati,Dahati,Iranians,Like a hillbilly or redneck; a villager or someone from the country
daikon,Daikon,Japanese,The Dakion Radish is very popular is Japanese cooking.
dak,DAK,Koreans,Dumb Ass Korean. Name given to Koreans by the Whites who visit the country.
dampback,DampBack,Mexicans,Part Mexican not quite wet.
dan,DAN,Blacks,Dumb Ass Nigger. Used to conceil racially discrimative remarks towards blacks when present.
dancingdragon,Dancing Dragon,Chinese,During Chinese festivals its typical to see many people in a long dragon costume in which they bounce up and down...usually in larger celebrations
dandruff,Dandruff,Whites,Self-expanatory
darkie,Darkie,Blacks,Skin color.
darkness,Darkness,Blacks,Self Explanatory. Often used to describe a crowd of African Americans.
data,Data,Asians,From the move The Goonies. Data was a stereotypical Asian child prodigy.
dawg,Dawg,Blacks,Some blacks call other Dawgs.  See: Homie
ddangkong,Ddang Kong,Vietnamese,Term used by Koreans to describe Vietnamese.  Literally means peanut.  Reasons for this word: 1) it may be because the word sounds very much like the language. 2) because they are short and Koerans have a tendency to call short people ddang kong (peanuts).
deadseapedestrian,Dead Sea Pedestrian,Jews,See: Red Sea Pedestrian.
dees-right,Dees-Right,Arabs,Arab people always ask Is dees right Is dees right? (meaning 'is this right?')
defendant,Defendant,Blacks,They are known often as this in a court of law
dema,Dema,Icelanders,dema refers to an ancestral deity in many mythologies that is murdered and then from the body comes some form of creation- i.e. a plant or the sky. it's also the name of some lunatic chick who lives in iceland.
demi-nigger,Demi-nigger,Arabs,Somewhat lighter skin tone than Blacks.
democrats,Democrats,Blacks,A popular political affiliation among African Americans. Also in reference to always wanting stuff for free.
deniro,DeNiro,Whites,A white man who dates black women
derkaderka,Derka Derka,Arabs,From Team America: World Police .
desabrido,Desabrido,Whites,Spanish slang for without color or flavorless with no substance.
desi,Desi,Indians,Refers to native Indians non-derogatory even humorous des means country and desi means fellow countrymen
desi,Desi,Cubans,Reference to Desi Arnaz.
destro,Destro,Blacks,Destro is the evil Cobra character from G.I. Joe.
deuce,Deuce,Blacks,On the Philadelphia police form 1=white 2=black
devil,Devil,Whites,Used mainly by Blacks to refer to the evil white man.
dexican,Dexican,Mixed Races,Dutch/Mexican mix.
dholia,Dholia,Whites,Indian for white person
dial,Dial,Jews,During WWII the Nazis would make soap out of the fat of the burned Jews (Dial is a brand of soap). This story is said to be true and also said to be merely war propaganda.
diaper-head,Diaper-Head,Arabs,Same idea as Towel-head or Rag-head.
dib,Dib,Israelis,Dumb Israeli Bastard. Commonly used by American Jews to deride the Israeli culture.
dicksuckinflog,Dicksuckinflog,Dutch,16th Century term for prostitutes accused of witchcraft.
diesel,Diesel,Native Americans,Rhyming slang diesel engine = injun
dimsum,Dim Sum,Chinese,Refers to the food. Used in the movie Romeo Must Die.
dingdong,Ding Dong,Blacks,Black on the outside white on the inside.  Blacks who act white
dinge,Dinge,Blacks,Used in the novel To Kill a Mockingbird.
dingofucker,Dingo Fucker,Australians,See Roofucker
dink,Dink,Vietnamese,Used in the movies Apocalypse Now and Platoon to refer to the North Vietnamese. Comes from French Vietnamese beaucoup dinky dau.  Beaucoup means very in French Dinky Dau is Vietnamese for crazy.  Shortened dink just means crazy
dirt-worshipper,Dirt-Worshipper,Native Americans,Made popular by HBO's Deadwood
dirtyknees,Dirty Knees,Arabs,In reference to the daily Muslim prayings on their knees
dirtysanchez,Dirty Sanchez,Mexicans,Common hispanic name.
ditchpig,Ditchpig,Whites,Redneck kids who play in the ditches/streets.
ditz,Ditz,Whites,Mentally lacking blonde haired white women.
do-da,Do-Da,Blacks,Black people stand by the mail box and ask the mailman Do 'da do 'da welfare check come today?
doener,Doener,Turkish,Avery common Turkish food (meat and vegetables in a roasted bread)
dog-breath,Dog-Breath,Koreans,Eating dogs plus mean temper.
dog-eater,Dog-Eater,Asians,They have been known to eat dogs; as seen on Faces of Death Volumes 1-6.
dog-fucker,Dog-Fucker,Whites,All bestiality porn actors are white
dog-muncher,Dog-Muncher,Asians,See Dog-Eater
dome,Dome,Dominicans,New York origin Washington Heights region. Used by other Hispanics to refer to the Dominicans.
domino,Domino,Mixed Races,Black / White
donkey,Donkey,Irish,It was cheaper to hire an irishman than a donkey in the pennsylvania coal minning days of the 1800's
donkeykong,Donkey Kong,Blacks,Donkey Kong was a large ape.
dootie,Dootie,Blacks,Refers to their dootie-brown skin.
doozers,Doozers,Whites,Used to describe white college students who do nothing but party and pull 2.0 GPAs.
dorito,Dorito,Blacks,Blacks have a fondness for Doritos.
dotknot,Dot Knot,Indians,Dot (red dot on forehead) Knot (turbins on Punjabs)
dot/dot-head,Dot/Dot-Head,Indians,Refers to the bindi (dot) on their foreheads. The dot's significance relates to the marital status of an indian female. Red dot: married; Black dot: single.
dottie,Dottie,Indians,Indians are the smart ones that put the dot in .com
doublea,Double A,Blacks,Shorter version of 'African American.'
doubled,Double D,Arabs,Desert Darky
doubledip,Double Dip,Blacks,Used for extra-dark Blacks appearing as if they were dipped in chocolate twice.
doujin,Doujin,Blacks,Japanese slur for blacks. Dou means dirt jin means person.
douse,Douse,Whites,Pronounced Doosss. Used by British Blacks of Jamaican heritage. Thought to originate from one of the first white men to reach Jamaica possibly a sailor
dozer,Dozer,Hispanics,They always work on in the field of construction thats were Bull Dozer comes into play.
dp,DP,Polish,Dumb Polish pronounced deepee. After World War II displaced refugees of Eastern European origin were referred as Displaced Persons however it stuck around even today to describe Polish immigrants.
drac,Drac,Romanians,Short for Dracula who is from a town in Transylvania which makes up a good deal of modern Romania.
drago,Drago,Russians,Character from Rocky 4 the  big dumb Neanderthal
dreads,Dreads,Jamaicans,Hair style.
dreidl,Dreidl,Jews,Jewish toy
driedshit,Dried Shit,Whites,Shit turns white after being left alone
drongo,Drongo,Australians,A drongo is a very Australian word for an idiot
drunk,Drunk,Irish,Irish are stereotypically drunks.
dryback,Dryback,Canadians,Canadian cross the border on land mostly unlike many Mexicans who do so via the Rio Grande (see Wetback)
drywaller,Drywaller,Hispanics,Hispanics do a lot of construction work and are usually paid very little or nothing.
dub,Dub,Ukrainians,Dumb Ukrainian Bastard.
dubya,Dubya,Americans,The not-so-bright president
duck,Duck,Vietnamese,Based on noises made by Vietnamese people speaking in their native tongue everything comes out sounding like duk-duk-duk. Also in reference to how old women walk.
dukenukem,Duke Nukem,Americans,Used the first Atomic bomb.
dumbwet,Dumb Wet,Hispanics,Variation of Wet-Back as used on an episode of X-Files.
dumb-inican,Dumb-inican,Dominicans,People from Domincan Republic
dunecoon,Dune Coon,Arabs,Comes from 'coon' (Blacks) of the 'dunes' (sand dunes) in the Middle East. Also just Dunecoon
dunenigger,Dune Nigger,Arabs,Same ideas as Doon Coon and Sand Nigger.
durka-durka,Durka-durka,Arabs,How English-speakers hear their language(s).  From the film Team America: World Police
dustynuts,Dusty Nuts,Arabs,It comes from Arabs living in the desert.
dwb,DWB,Whites,Down With Brown. A white female who dates black men.
dwb,DWB,Blacks,Driving While Black.  Police-type term referring to blacks driving through white neighborhoods.
dwo,DWO,Asians,Driving While Oriental. Based on the idea that being Asian and driving is just as dangerous as being intoxicated and driving.
dyke,Dyke,Dutch,The country owes its existence to the many dikes that were used to reclaim land from the sea also from the story of the Dutch boy who used his finger to plug a leaking dike to save his town. Van Dyk/Dijk/Dyke is also a very distinctive Dutch last name.
dyke-jumper,Dyke-Jumper,Dutch,Because of all the dykes in Holland Dutch farmers used to use long wooden poles to pole-vault from one section of farmland to another.
easy-bakenigger,Easy-Bake Nigger,Jews,WWII reference.
egg,Egg,Whites,White males that try to really get into East Asian culture and date Asian women. White on the outside yellow on the inside (opposite of banana).
egghead,Egghead,Asians,Asians especially Koreans have large heads.
egglet,Egglet,Blacks,Black Children -- little eggplant.
eggot,Eggot,Blacks,Tagalog word for black (Phillipines)
eggplant,Eggplant,Blacks,Slur used mainly by Italians. See: Moolie.
eggplantparmesan,Eggplant Parmesan,Mixed Races,Black/Italian mix
eggroll,Eggroll,Asians,Refers to Asian babies who would be wrapped in blankets.
egot,Egot,Blacks,A derogatory term used by Filipinos meaning nigger.
egoy,Egoy,Blacks,Filipino racial slang for Black people
eightball,Eight Ball,Blacks,Color of the eight ball in pool
elchino,El Chino,Chinese,It was used by Equadors in addressing Alberto Fujimori during war as a result of Berlin Congress in 19c where borders left apart. The war was almost on Cocain- main source for living in Latin America. Fujimori is Japanese decent immigrated to Peru at 5.
elephantjockey,Elephant Jockey,Indians,Elephants were a popular mode of transport in Victorian and Pre-Victorian Asia
elevatoroperator,Elevator Operator,Blacks,Non-demanding job for education-less/trade-less person.
elvis,Elvis,Whites,Used by blacks to describe a white person doing black things like Elvis did with black music.  Eminem is referred to as Elvis in the film 8 Mile
eminem,Eminem,Whites,White male who tries to act Black
eraserhead,Eraser Head,Blacks,During the late 80's and early 90's it was popular for blacks to cut their hair at an angle forming a bevel that look similar to those pink erasers that you used in grade school.
es-obe,Es-obe,Blacks,Meaning Apes Obey! Used by British Colonial masters in Africa commanding the African workers to get to work. The early colonized Africans not knowing the meaning of the command also cultivated it into their language- using it among themselves to gather themselves to work efficiently.
esau,Esau,Whites,Hebrew Israelites refer to whites as being the actual color of red. A white person laughs gets angry slapped and cries will turn red. Also being the direct lineage of Easu as oppose to Blacks and American Indians being the lineage of Jacob according to Genenis chp.25 vers 25 and Genesis chp. 36. Doing research of the Roman Empire you will find that the Romans were known as the Edomites. King Herod was an Edomite and before Rome was known as Rome it was known as the city of Edom.
eskimo,Eskimo,Native Americans,Eskimo was once acceptable in Canada and still is almost anywhere else. It means raw meat eater. Eskimo orginated from southern Indian tribes describing the northern Inuit whom they were constantly fighting. Inuit take offence to being called Eskimos despite the fact that they do eat raw meat.
etch,Etch,Indians,Some say their music sounds like etch-a-sketch.
etchy,Etchy,Whites,Comes from Sketchy and denotes the foreman at a jobsite (often with sketchpad in hand)
etnikum,Etnikum,Gypsy,Hungarian word for ethnic.
eucalyptusnigger,Eucalyptus Nigger,Australian Aboriginals,The eucalyptus is a native plant of Australia.
eurinal,Eurinal,Europeans,Many European countries use pay-toilets having to pay for public restrooms. Europe + Urinal
euro,Euro,Mediterraneans,Represents whites of mediterannean nations such as Greeks Italians Spaniards and Portuguese. Named after the habit of starting every name with Euro. (Eurotunnel eurotrash etc)
eurotrash,Eurotrash,Europeans,A pseudo-intellectual who believes they are are smart and americans are stupid.
ewok,Ewok,Arabs,Refers to Muslim religious headdress resembling that worn by the Star Wars characters Ewoks.
extracrispy,Extra Crispy,Blacks,A southern exspression that represents their burnt appearence as well as their stereotypical love of fried chicken.
fabo,Fabo,Australian Aboriginals,Fucking Abos
fadi,Fadi,Arabs,Common Arab name plural is Fadii (Fa-Die).
fahim,Fahim,Blacks,Arabs use this word meaning charcoal to describe blacks and very dark arabs
fakemexican,Fake Mexican,Hispanics,Used to describe those who have lost the language culture etc. of Mexico.
fakeyjamaikey,Fakey Jamaikey,Blacks,Blacks who try to act Jamaican but actually aren't. Mostly used on TV or for musical purposes. For example Miss Cleo: psychic advisor and tarot card reader.
falasha,Falasha,Jews,Ethiopian Jews. A derogotory nickname. The proper name is Bet-Yisrael
fankuei,Fan Kuei,Whites,Chinese for ocean ghosts. Refers to skin color.
farang,Farang,Whites,From the Thai word for French (farangsayt) who were among the first to colonize Southeast Asia. Generally non-derogatory though depends on context and intention of speaker. Applies to people of non-Thai origin.
farang/falang,Farang/Falang,Whites,Means foreigner (i.e. non-Thai) of the white race. It is very frequently used in a simple descriptive way. It's negative only if the intent of the speaker is such.
farq,Farq,Whites,Arab word meaning chicken used to describe whites and light skinned arabs as in weak and fragile
fatalbert,Fat Albert,Blacks,Used against overweight African American males in reference to a popular 1980's cartoon created by Bill Cosby (for example saying hey hey hey around a fat black man could be considered offensive by some)
fbi,FBI,Native Americans,Full Blooded Indian. Used in the movie Thunderheart. Not really a slur.
feargal,Feargal,Blacks,Short for Feargal Sharkey (a UK Pop singer from late 70's and 80's) which rhymes with Darkie.
feather,Feather,Native Americans,Used to differentiate Indians from India (Dots) from those from America (Feathers).
featherhead,Featherhead,Native Americans,Comes from Native American tribes that wore feathered headdresses.
feb,Feb,Blacks,February is Black history month.
feb,Feb,British,Stands for Filthy (or Fucking) English Bastard.
felipeparkhurst,Felipe Parkhurst,Guatemalans,Exiled from the country for life for selling many children to slavery.
fencefairy,Fence Fairy,Mexicans,Reference to border crossing.
fence-hopper,Fence-Hopper,Mexicans,Mexicans hopping fences to get into the U.S.
fenian,Fenian,Irish,Refers to Irish Roman Catholic immigrants living in such large U.K. cities as Glasgow Liverpool and Manchester. Also used by Protestants to demean Catholics in Northern Ireland. Irish republicans use it to identify themselves as a member of Sien Fienn the political party of the IRA.  Derived from Gaelic stories of the Fianna a mythical group of warriors.  Not inherently derogatory.
fesskin,Fesskin,Mexicans,Fuckin' messkin (mexican)
fez,Fez,Arabs,They wear fezes the little hats.
fidel,Fidel,Hispanics,Reference to the infamous Cuban dictator Fidel Castro.
fieldnigger,Field Nigger,Blacks,Field nigger is the term used to label blacks who choose not to identify with popular white society and culture as opposed to house niggers--blacks who bend over backwards to win or maintain favor with whites while relishing in the fact that they at least reside in the house with the master rather then outside with the majority of blacks.
fieldrat,Field Rat,Mexicans,Working in Migrant Fields
figgobbler,Fig Gobbler,Arabs,They eat figs.
fila,FILA,Blacks,Finally I Left Africa popular clothing brand
filicheesesteak,Fili Cheese Steak,Filipinos,Refers to what it looks like when a Filipino woman is in a gangbang
filthypino,Filthy Pino,Filipinos,Poor Filipinos Filipinos who act black.
fingernailrancher,Fingernail Rancher,Asians,A lot of Asians own Nail Salons
finne,Finne,Finnish,Swedes call Finns for finne which means pimple in Swedish.
firangi,Firangi,Whites,From Arabic Firanji or Firangi in Egyptian Arabic meaning European. Corruption of French or Franks. Made famous in a slyly ironic way by the ultracapitalist Ferengi on Star Trek.
firebush,Fire Bush,Irish,Red hair.
firecrotch,Fire Crotch,Irish,They have red hair
firecracker,Firecracker,Whites,White women who date Black men. There used to be a firecracker called a niggerchaser but today they are called simply chasers.
firecracker,Firecracker,Arabs,They blow themselves up.
firewood,Firewood,Jews,WWII Holocaust reference. 'Nazi Firewood' to be more specific.
fischkopf,Fischkopf,Germans,Fish-head used by southern Germans for northern Germans
fish,Fish,Israelis,Fucking Israeli Shithead. See: Dib.
fish,Fish,Portuguese,Bacalou (codfish) is a major part of their diet.
fish,Fish,Bengals,Bengali's eat a lot of fish and go fishing often. This slur is used commonly by Pakistanis.
fish-belly,Fish-Belly,Whites,Similar color
fish-eater,Fish-Eater,Norwegians,Their diet consists almost entirely of fish.
fishhead,Fishhead,Asians,Japan's only true source of food is the sea so they eat a lot of fish.
flash,Flash,Americans,Fucking Lazy American Shit Head.  Used by Israelis to refer to American tourists who are accustomed to an easier standard of living.  Compare with dib entry in list.
flat-ass,Flat-ass,Whites,Used as reference to the flatter backsides of white people and other non-blacks
flat-back,Flat-Back,Whites,Term refers primarily to white women who unlike women of other races have flat butts and no shape.
