searchSlur,Slur,Represents,Reason
septic,Septic,Americans,Short for Septic Tank which is rhyming slang for Yank. Commonly used in Ireland. May also be used in the UK.
septictank,Septic Tank,Americans,Cockney rhyming slang for yank often abreviated to Seppo
septic/sherman,Septic/Sherman,Americans,Cockney rhyming slang. Septic Tank/Sherman Tank = Yank
serialkiller,Serial Killer,Whites,Most serial killers are white.
serpent,Serpent,Whites,See: Snake
sexican,Sexican,Hispanics,Refers to how fast the Mexican-American population is increasing.
sfa,SFA,Americans,Stupid Fucking American - not very clever but very prevelent in Europe
shackledragger,Shackle Dragger,Australians,Deported british convicts.
shade,Shade,Blacks,Old-fashioned term derived because blacks are dark like a shade
shadow,Shadow,Blacks,Refers to color of skin
shadow-smurf,Shadow-Smurf,Blacks,They the darkest of all Smurfs.
shaft,Shaft,Blacks,Black man from black exploitation film Shaft
shakazulu,Shaka Zulu,Blacks,Leader of the Zulu tribe in Africa located in present day Zimbabwe
shamrocknigger,Shamrock Nigger,Irish,Shamrocks represent Ireland's heritage
shant,Shant,Irish,Poor Irish People. Derived from the shacks they lived in -- the shanty.
sheeny,Sheeny,Jews,From Yiddish shaine or German schon meaning beautiful.
sheepdip,Sheep Dip,Whites,Describes White Ranchers that have sex with Sheep.
sheep-shagger,Sheep-Shagger,Welsh/Scottish,There's a myth that Scotsmen and/or Welsh have a thing for buggering sheep. The sheep are said to outnumber the people in both some European and Australian countries/states. On an interesting note the first sheep was cloned in Scotland.
sheepie,Sheepie,New Zealanders,Well know for their habits with sheep
sheethead,Sheethead,Whites,Refers to the KKK.
sheister,Sheister,Jews,Like a shyster lawyer. One who carries on any business especially legal business in a mean and dishonest way.
shiksa,Shiksa,Whites,Yiddish word used mainly by Orthodox Jews to describe non-Jewish women or a Jewish woman who doesn't observe all Jewish precepts.
shillelagh-hugger,Shillelagh-Hugger,Irish,A shillelagh is a staff commonly use by the Irish
shine/shiner,Shine/Shiner,Blacks,In reference to the shine their skin can sometimes give off. Also a 1920's main occupation shoe shiners.
ship-wreckedmexican,Ship-wrecked Mexican,Puerto Ricans,The island of Puerto Rico
shippingcargo,Shipping Cargo,Blacks,Refers to slave trading. Slaves to be shipped were packed inhumanly close.
shiptar,Shiptar,Albanians,A derogatory term employed by Balkan Slavs (Croats Serbs Montenegrins and Macedonians) when referring to Albanians.  However its use parallels that of the word nigger in the United States.  In that Albanians use the word shiptar to address/describe one another while taking insult from its use by non-Albanians.  Note: The word shiptar is most likely derived from the name of the Albanian language - Shqiptar.
shithand,Shit Hand,Arabs,Refers to the Arab custom of wiping one's butt with the left hand rather than with toilet paper.
shitpalm,Shit Palm,Whites,They never wash their hands when they go to the washroom
shit-eater,Shit-Eater,Germans,Feces eating is a fetish that originated in Germany otherwise known as scat sex or shit sex eg. shit eating rubbing shit etc.
shit-kicker,Shit-Kicker,Whites,From farmers or country boys walking through the cow pastures.
shit-slinger,Shit-Slinger,Blacks,A typical behavior of monkeys is to throw feces.
shitheel,Shitheel,Blacks,Slang term for a Black servant. Southern origins.
shitskin,Shitskin,Blacks,Color of skin.
shnozzle,Shnozzle,Jews,They have large noses or shnozzes.
shoe,Shoe,Dutch,Name is derived from the wooden shoes they would wear.
shoeshiner,Shoe Shiner,Blacks,Many shoe shiners in cities are black.
shonnicker,Shonnicker,Jews,Early 20th century American
shoobie,Shoobie,Canadians,Reference to tourists from Canada who come to the shore. Also reference to any tourist.
shovel,Shovel,Bosnians,Many bosnians have large heads with flat facial features.
shovel-head,Shovel-Head,Koreans,Believed their heads look like shovels. Also shovel-face
shuffalong,Shuffalong,Blacks,Supposed to mean shuffle along. Refering to lazy slaves.
shvartz,Shvartz,Blacks,Yiddish (German origin) word for Black. Used neutrally and disparagingly.
shvatsa,Shvatsa,Blacks,Yiddish word for nigger
shvooga,Shvooga,Blacks,Another word in Yiddish that means nigger
shylock,Shylock,Jews,Comes from Shakespeare's The Merchant of Venice.
sid,Sid,Irish,Small Irish Dick. Irishmen are proud of their manhood
silver-tip,Silver-tip,Swedes,Many Swedes have hair so blonde that it appears silvery
silverback,Silverback,Blacks,Old Black. Silverbacks are the leaders in a pack of gorillas.
silvery,Silvery,Blacks,Cockney rhyming slang for Coon - Silvery Moon - Silvery.
simian,Simian,Blacks,Primate
simpson,Simpson,Asians,The Simpsons are yellow
sirmixalot,Sir Mix A Lot,Blacks,They like big butts and they cannot lie...
siwash,Siwash,Native Americans,Originates from the French word Sauvage which means savage
six,Six,Blacks,In the times of political correctness this is a good way to say Nigger without getting jumped. I belive it has to do with 6 letters in the word nigger. To use in a sentence; Hey look at that 6 over there.
sixpoint(er),Six Point(er),Jews,Six points on the star of David
six-nose,Six-nose,Jews,Jews have hooked or six shaped nose
six-weeker,Six-Weeker,French,Derogatory term used by Germans due to the quick collapse of France during WWII.
sixer,Sixer,Blacks,On the U.S. census African American is code number six on the list of ethnicities.
skel/skell,Skel/Skell,Whites,White Trash. A centuries-old word that has made a recent comeback seems to be used mainly by blue-collar whites. Originally meant the lowest form of vagrant.
ski,Ski,Somalians,Because they are thin (like skis)
skier,Skier,Polish,A lot of Polish last names end with -ski
skillet,Skillet,Blacks,Refers to the color of iron skillets.
skimo,Skimo,Eskimos,Derogatory slang of 'Eskimo'.
skinflint,Skinflint,Blacks,Skin appearance related.
skinhead,Skinhead,Whites,A popular white supremacist group.
skinny,Skinny,Somalians,Because of the time in 1992 where 300000 somalians were starved. Used in the film Black Hawk Down (2002).
skip,Skip,Australians,White Australians specifically. From Skippy the Bush Kangaroo.
skippypoofter,Skippy Poofter,Australians,Comes from ethnic immigrants; skippy meaning kangaroo and poofter is how aussies say someone is gay. So skippy poofter is common insult
skunk,Skunk,Mixed Races,White/Black mix
slackjaw,Slackjaw,Whites,A recessive gene cause the lower jaw to protrude outward more than the upper.
slant,Slant,Asians,Facial description -- referring to the eyes.
slantey-eye'd,Slantey-eye'd,Asians,Facial description -- referring to the eyes.
slave,Slave,Blacks,Self-explanatory.
slaveships,Slave Ships,Blacks,Refers to pregnant black women. The idea is that they are carrying many children packed tightly inside. Similar to a slave ship.
sleepercell,Sleeper Cell,Arabs,Terrorism-related
sleepwalker,Sleepwalker,Asians,Small eyes appear to be closed even during the day
sleestack,Sleestack,Blacks,From Land of the Lost. The Sleestacks were stupid slow and apparently very lazy. They could never catch Chaka.
slide,Slide,Blacks,Used by some police.  It was created so that they could refer to blacks in a derrogatory way and not get in trouble.  Said because blacks 'slide' through everything - they're lazy.  Also said part of the White Castle family ('sliders').
slim,Slim,Somalians,Same as Skinnie
slimshady,Slim Shady,Whites,From the Rapper Eminem thought of as a white person who tries to be black.
slingshot,Slingshot,Palestinians,They use slingshots as weapons
slit,Slit,Asians,Another eye reference.
sloat,Sloat,Vietnamese,From French Indo-China [?]
slope,Slope,Asians,Facial description Self-explanatory. Also: Slopehead
slopehead,Slope Head,Asians,Their faces are rather slopped
slotmachine,Slot Machine,Asian,their eyes look like coin slots
slurpee,Slurpee,Arabs,Traditional convenience store employee.
slurpeejockey,Slurpee Jockey,Indians,Reference to convenience store franchises
slurpeenigger,Slurpee Nigger,Arabs,Operation of convenience stores which sell Slurpees.
slushee-slinger,Slushee-Slinger,Arabs,In reference to how many Arabians deal slushees out of their convenience stores.
smack,Smack,Asians,They look like they've been smacked in the forehead giving a slope and a squint to their eye.
smigger,Smigger,Blacks,From the joke what do you call a Black Smurf?
smoke,Smoke,Blacks,From the similarity between their skin color and the color of smoke. Also from the way that they were said to be able to sneak around quietly entering a room like smoke.
smokejumper,Smoke Jumper,Whites,White women who date Black men.
smoke-signal,Smoke-Signal,Native Americans,Many American Indians communicated by using smoke signals.
smokedirish,Smoked Irish,Blacks,Irish especially during the late 19th early 20th century were thought of as no better than niggers and conversely blacks were associated with them.
smokefoot,Smokefoot,Blacks,Color of feet.
smokestack,Smokestack,Blacks,Believed to originate in pre WW II Detroit. Comparison to the blackened smokestacks of the manufacturing plants.
smokey,Smokey,Blacks,Self explanatory
smore,Smore,Samoans,Letters rearranged
snail-snapper,Snail-Snapper,French,They eat snails
snake,Snake,Whites,Refers to them being sneaky and evil.
snakecharmer,Snake Charmer,Arabs,Known to frequently charm Cobra snakes.
sneakers,Sneakers,Blacks,They always come in pairs
snickerlicker,Snicker Licker,Whites,Whites who date Blacks
snigger,Snigger,Arabs,Short for Sand Nigger
snigger,Snigger,Blacks,Snow nigger. Black people seen on the ski slopes; a stereotype that they generally don't go skiing because they dislike the cold.
snipcock,Snipcock,Jews,Henry Ford used it reference to circumcision
snipes,Snipes,Blacks,Wesley Snipes is the blackest of the Black people.
snob,Snob,Blacks,Blacks who can't afford cars and are always seen riding bikes: (S)illy (N)iggers (O)n (B)ikes
snow,Snow,Whites,Snow is white
snowbird,Snow Bird,Canadians,The Snowbirds are a group of Canadian airforce pilots who display their flying at air shows.
snowbird,Snow Bird,Jews,Refers to old Jewish retirees who transplant themselves to Florida. Although they move to the sunshine state they stay indoors thus retaing their white color.
snowchink,Snow Chink,Eskimos,They look fairly Asian and live in the snow
snowmonkey,Snow Monkey,Canadians,Lots of snow in Canada
snownigger,Snow Nigger,Eskimos,Self-explanatory.
snowback,Snowback,Canadians,Play on 'wet-back'.
snowblower,Snowblower,Eskimos,An out-of-shape eskimo that breathes heavily after walking a few feet in the snow.
snowfrogs,Snowfrogs,French Canadians,French = frogs living in Canada = snow
snowman,Snowman,Whites,Snowmen are white.
soak,Soak,Mexicans,Much like a wetback when they cross the Rio Grande river their backs get soaked.
soapdodger,Soap Dodger,French,From the French habit of not appearing to bathe regularly. Also France supposedly has the lowest per capita soap consumption in Europe.
socketface,Socket Face,Asians,Thier eyes are slitted like the electrical sockets on a wall.
sodbuster,Sodbuster,Americans,People moving to the Midwest built their homes out of thick sod since no other building material was available. They also had to break up the sod to plant crops.
soggycracker,Soggy Cracker,Mixed Races,White/Mexican. Wetback and Cracker.
sole,Sole,Samoan,Pronounced 'So Lee' means male in Somoan.
somppu,Somppu,Somalians,Somali Refugee In Finland
son,Son,Blacks,Refers to the way blacks speak Ebonics and append the word son to every phrase/sentence.
sooty,Sooty,Blacks,Self-explanatory
sortarican,Sortarican,Puerto Ricans,Mix of Puerto Rican and any other race. Read in National Lampoon.
soulfood,Soul Food,Blacks,From the black drama Soul Food.
soup,Soup,Mixed Races,A person who has many different races in his blood.
southernwindchime,Southern Windchime,Blacks,During the days of the KKK many black people were hanged from th same tree.
soutpiel,Soutpiel,English,South Africa Afrikaans for 'salt dick' as English South Africans have one foot in SA the other in UK and dicks in ocean.
soysauce,Soy Sauce,Asians,They love soy sauce
soyback,Soyback,Asians,Refers to Asains always using soy sauce
spabook,Spabook,Blacks,Used by Michael Jackson for some unknown reason
spaghettivender,Spaghetti Vender,Italians,Self explanatory
spaghetti-slurper,Spaghetti-Slurper,Italians,Popular Italian dish and method of eating said dish
spaghetti-twister,Spaghetti-Twister,Italians,Popular Italian dish and method of eating said dish
spaghetto,Spaghetto,Italians,Italians who act Black
spanglish,Spanglish,Hispanics,Spanish-Americans; English-speaking Hispanics also the language they speak.
spear-chucker,Spear-Chucker,Blacks,Comes from the hunting styles of African tribal natives.
spec,Spec,Hispanics,Baby Spic. See: Spic.
specialmeal,Special Meal,Jews,When a Jewish person gets a meal on a plane it's from the kosher menu and a special meal not offered to regular passengers
speeddemon,Speed Demon,Hispanics,Amphetamines are popular among Hispanics.
spegro,Spegro,Mixed Races,Spanish/Black mix.
spew,Spew,Mixed Races,Spanish/Jewish mix.
spic,Spic,Hispanics,Short for Hispanic. Might also be acronym of SPanish Indian and Colored coming from the mixed breeds that resulted from the union of Spanish colonists Indian natives and Black (colored) slaves. From the OED. spic A. n. a. A contemptuous and offensive name for a Spanish-speaking native of Central or South America or the Caribbean; a spiggoty. - It dates back (in print) to at least 1913. However I understand it first applied to Italian immigrants in the late 1800s - More information: 1938 Amer. Speech XIII. 311/1 Spiggoty originated in Panama during Construction Days and is assumed to be a corruption of 'spikee de' in the sentence 'No spikee de English'
spicandspan,Spic and Span,Hispanics,Self Explanatory
spicaninny,Spicaninny,Mexicans,Young Mexican girls. Combination form of Spic and Picaninny.
spicerubber,Spice Rubber,Indians,Because they use massive spices in their cuisine and they rub them on their bodies.
spicetfence,Spicet Fence,Mexicans,10 mexicans lined up side by side at the border.
spickaboo,Spickaboo,Mixed Races,Mexican/Black mix. Derived from 'Spic' and 'Jigaboo.'
spicnic,SpicNic,Hispanics,Hispanics who pull over on the side of a main highway pop the hood on their car set up the volleyball net sit on thier coolers and have a picnic.
spicracker,Spicracker,Mixed Races,Hispanic/White mix.
spicycracker,Spicy Cracker,Mixed Races,White/Mexican mix
spider,Spider,Italians,Reference to a character in the film GoodFellas.
spigger,Spigger,Mixed Races,Hispanics/Black mix. Combination of 'Spic' and 'Nigger.'
spike,Spike,Mixed Races,Jewish and Hispanic Spic + Kike = Spike
spink,Spink,Mixed Races,Spanish/Chinese mix. Combination of 'Spic' and 'Chink.'
spivic,Spivic,Hispanics,Often referred to Hispanics that drive Honda Civics
spizzician,Spizzician,Mixed Races,Hispanic/Guatemalan mix. Pronounced spizzz-ik-ien.
splib,Splib,Blacks,Most likely origin comes from the 1960's as an acronym for: South Philadelphia Lower-Income Blacks.
spliv,Spliv,Blacks,Washington DC area police term
spoda,Spoda,Blacks,How blacks talk (ex.) We ain't Spoda be here. (we aren't supposed to be here)
spongehead,Sponge Head,Blacks,African's naturally bouncy/kinky hair when uncut tends to be big and poofy when dried out. When you sqeeze it it seems as if it would bounce back at release
spook,Spook,Blacks,Because of their dark skin which can blend into the night making them ghost-like.
spoon,Spoon,Blacks,From the reflection you see when looking at a spoon. Originates from the shape of a Black person's nose
spoonbill,Spoonbill,Blacks,A spoonbill is a type of bird. Look at one and the origin will be obvious.
spoonhead,Spoonhead,Cardassians,Facial feature looks like a spoon on their forehead
spota,Spota,Blacks,(Pronounced Spoh-tuh) Stereotype of dumb inner city blacks' slang for supposed to.  Spota get a job.  Spota take care of the kids.  Spota not break the law.
sprucemonkey,Spruce Monkey,Native Americans,Spruce forests
spud,Spud,Irish,The heavy influence of the potato in Ireland.
spudnigger,Spudnigger,Irish,Irish/Potato relationship. Also Spudfucker.
sputnik,Sputnik,Russians,The world's first artificial satellite sent into space. Not really a heinous threat but sounds that way.
squanto,Squanto,Native Americans,Name of a Native American who helped the English colonists in Massachusetts develop agricultural techniques and served as an interpreter between the colonists and the Wampanoag.
squarehead,Squarehead,Scandanavians,Shape of head late 19th/early 20th century American word. Applies to all Scandinavians.
squarehead,Squarehead,Albanians,Many Albanians seem to have a square head
squaw,Squaw,Native Americans,Refers to Native American women. Usually thought to refer to a woman's vagina but this is fairly controversial .
squawhopper,Squaw Hopper,Native Americans,Usually associated with natives but also used for anyone in a relationship with a native female
stableboy,Stable Boy,Croats,Their most common occupation in Austrian Empire. Betch-key ko-new-sharey Serbian pronounciation.
stacks,Stacks,Blacks,From the movie Goodfellas character Stacks Edwards the only black character manages to fuck up the heist.
stallion,Stallion,Italians,Like in the movie Rocky Rocky an Italian was know as the Stallion.
stan,Stan,Arabs,AfghaniSTAN PakiSTAN etc.
stein,Stein,Jews,Common name
stepnfetchit,Stepn Fetchit,Blacks,Stage name of American actor Lincoln Perry type cast as a slow uneducated & easily frightened Black man. Derogatory term also used to suggest the toady behavior of Black civil servants.
stinkian,Stinkian,Armenians,Odor
stormwatcher,Stormwatcher,Whites,Trailer trash that are forced to watch tornadoes while trapped in trailors.
stovelid,Stovelid,Blacks,A book from the 1950's set in Florida (_The Lotus Eaters_) used Stovelid which makes some sense if you've ever operated a big wood stove - the lids are the disks set into the big holes on top (these eventually became burners when the design was refined to use gas or electric).
stovepipe,Stovepipe,Blacks,Stovepipes from wood-fired stoves get encrusted with black soot hence the association.
strangefruit,Strange Fruit,Blacks,Coined by Blacks during slavery to refer to other Blacks who were hanged from trees. Used in a Billie Holiday song during the Civil Rights movement. See: Apple (2).
straphangers,Strap Hangers,Blacks,When the whites were sitting on the bus the blacks had to stand and hold onto the strap.
streetcheetah,Street Cheetah,Blacks,A reference to the ghetto i.e. uneducated Black criminals hanging around the streets day and night along with the speed of young black males like Cheetahs the fastest animals in the jungle.
stump/treejumper,Stump/Tree Jumper,Whites,Rednecks use Stump Jumper or Tree Jumper against hillbillies lower than themselves but they also use it to point out hillbillies that commit incest- jumping the family tree.
sub-human,Sub-Human,Blacks,They are said to be the missing link between apes and humans.
sudaca,Sudaca,South Americans,Used in Spain as a derogatory term for South American immigrants. Derived from the Spanish word for South American (sudamericano).
suddha,Suddha,Whites,Sinhala (Sri Lankan language) word for white. Similar to Gora
sungoblin,Sun Goblin,Arabs,Small ulgly vicious creatures of a sunny land
sunarefa,Sunarefa,Arabs,Used by Russian metal band Korrozia Metalla on the song (title translates to) Kill The Sunarefa. Sunarefa refers to a Soviet brand of cold medicine. I do not know if Korrozia Metalla (Corrosion of Metal) were the first to use this slang or how it came about but it seemed very widly understood among Russian youth.
sunnysideup,Sunny Side Up,Asians,Refers to Asians who believe they are white on the inside and try to fit in with whites but are really Asian and yellow on the outside. Sunnyside up has a white inside and yellow outside
superfly,Superfly,Pacific Islanders,WWF wrestler Superfly Jimmy Snuka.  Could be used for any dark-skinned individual.
surrendermonkeys,Surrender Monkeys,French,Referenced by Groudskeeper Willy on the Simpsons
svenne,Svenne,Swedes,Used by immigrants in Sweden about Swedes
swami,Swami,Indians,A Hindu religious teacher.
swampdonkey,Swamp Donkey,Blacks,Blacks from rural areas
swampkike,Swamp Kike,Cajuns,It has been said that Cajuns are the Jews of Louisiana because of their propensity for commerce and finance. The slur is used by any non-Cajun Black and White alike.
swampyankee,Swamp Yankee,Americans,Of the same nature as trailer trash but referring to a poor Whites who live in the boonies.
swamp-runner,Swamp-Runner,Blacks,Blacks running from slavery
swamper,Swamper,Blacks,Refers to poor blacks who live in rural areas especially if the area is predominantly white
sway,Sway,Blacks,They tended to sway from trees back in the Civil War days.
sweatysock,Sweaty Sock,Scottish,Cockney rhyming slang -- Jock = Sweaty Sock
swedishmeatball,Swedish Meatball,Swedes,Greasy beef balls from Sweden.
sweetback,Sweetback,Blacks,Name of Black Pimp in Melvin Van Peebles movie who kills white police and gets away with it common aspiration of black ghetto youths
swine,Swine,Whites,Relates to the pink color of the pig's color.  Tendency for the pig to lay in or eat anything. (Refers also to police men)
swinger,Swinger,Blacks,Blacks being hung
swirlie,Swirlie,Mixed Races,Black/White mix.
tab,Tab,Asians,Trendy Asian Bitch. Self explanatory
tabeetsu,Tabeetsu,Whites,Used by Chinese. Means great-nosed ones.
tableface,Table Face,Asians,They tend to have flat faces.
taco,Taco,Hispanics,Because they eat tacos.
tacobender,Taco Bender,Hispanics,Because they eat tacos.
tacojockey,Taco Jockey,Mexicans,Self-explanatory
taconigger,Taco Nigger,Hispanics,Because they eat tacos.
tacoshell,Taco Shell,Whites,White women who sleep with Mexicans
tadpole,Tad Pole,French,French baby
taffy,Taffy,Welsh,The Taff is the name of the river that runs through Cardiff the capital of Wales. Also from a poem that starts: Taffy was a Welshman Taffy was a thief.... Another explanation is that Taffy is based on an English pronuciation of the common Welsh first name Daffyd (David).
tagger,Tagger,Blacks,They often leave the tags on clothing.
tai-chink,Tai-chink,Asians,Martial arts.
taig,Taig,Irish,Means hero in Gaelic.  Used today as an insult by the Loyalist community in N Ireland.
taillessmonkeys,Tailless Monkeys,Filipinos,Americans who came to the Philippines at the end of the 19th century called Filipinos tailless monkeys because they were small brown and said to live in trees.
tamale,Tamale,Hispanics,A common latin American food.
tans,Tans,British,Refers to the criminal army the English sent into Ireland to rape plunder and terrorize the inhabitants. The uniform was made up of tanned bottoms and dark upper clothing. They became known as the black and tans.
tap,TAP,Americans,Typical American Prick
tap,TAP,Taiwanese,Taiwanese American Princess
tapehead,Tape Head,Asians,Facial characteristics--slanted eyes as if someone pulled back their eyes using Scotch tape around the back of their head.
tarbaby,Tar Baby,Blacks,Skin color. From the Uncle Remus (Br'er Rabbit) story.
taran,Taran,Romanians,Equivalent to calling someone a redneck.
target,Target,Iraqis,Gulf War related.
target,Target,Indians,The dot on their head looks like a laser sight.
taro,Taro,Polynesians,They eat a hell of a lot of Taro. It's why they're so big
tatertot,Tater Tot,Irish,Irish Child.
taxi,Taxi,Asians,Taxis are yellow
taxidriver,Taxi Driver,Indians,The famous New York taxi drivers
tea-wop,Tea-wop,British,Tea-drinking immigrants.
teabag,Teabag,British,British are said to drink a good deal of tea.
tedstevens,Ted Stevens,Blacks,A brand of candied chocolate in England; Quite dull and worthless.
tee-peecreeper,Tee-Pee Creeper,Native Americans,Some live in tee-pees.
termite,Termite,Whites,Termites are typically white pale or clear.
terr-ab,Terr-ab,Arabs,Short for terrorist-Arab
terrence,Terrence,Blacks,Likely comes from the black singer Terence Trent D'Arby who claimed that his debut album was the most important album since Sgt. Pepper and then bored his audience with self-important lyrics losing major credibility in the process.
terrone,Terrone,Italians,Southern Italians. Any Italian living more south than Rome very offensive describes living standards and cultural differences from the more European north. The Italian word Terra means land or dirt so a Terrone is one who works with the land.
terrorist,Terrorist,Arabs,Self explanatory.
test-taker,Test-Taker,Asians,Asians are always taking standardized tests to further their education.
tetris,Tetris,Russians,Popular video game which originated in Russia
tex-mex,Tex-mex,Mexicans,A person of hispanic lineage hopefully Mexican that is from Texas.
texican,Texican,Mexicans,Brown texans usually illegal and doing drywall work. Technically: a Hispanic-American that lives in Texas
thankyoucomeagain,Thank You Come Again,Indians,A phrase made popular by stereotypical Indian convenience store owner Apu on The Simpsons.
theelement,The Element,Blacks,Used in reference to minorities in terms of location. Example: This neighborhhod was nice until the element moved in. Not necessarily specific to Blacks.
themissinglink,The Missing Link,Blacks,The oldest living black person in a community.
thicklips,Thick Lips,Blacks,Originates from Shakespeare's Othello
thickmick,Thick Mick,Irish,Commonly used in England where Irish immigrants did much of the manual labour. Thick meaning stupid Mick as an abbreviation of Michael a common Irish Christian name.
thief,Thief,Blacks,Common stereotype
thin-eyed,Thin-Eyed,Asians,In Russian uzko glaziye means thin eyed and is used for referring to all Far East Asians.
