searchSlur,Slur,Represents,Reason
landscaper,Landscaper,Mexicans,Mexicans do a lot of landscaping.  Similar to landscraper.
landya,Landya,Arabs,Actually means 'cut cocks' because of the rite of circumcising followed by Muslims.
langosta/langostina,Langosta/Langostina,Cubans,Means Lobster slang for Cuban women because like the lobster they carry all their meat in the tail
lao-mo,Lao-Mo,Hispanics,Chinese. Mo is the first chinese character of Moxige (Mexico) and also happened to mean Old Ink
lao-wai,Lao-wai,Whites,Applies to all foreigners in China. Literally means Old Outsider.
laplander,Laplander,Sami,The Sami (Saami/S�mi) are known for wearing patchwork clothing which is what 'lap' means. It's used across northern Scandinavia and is equivalent to calling an Inuit an 'Eskimo'
laposta,Laposta,Italians,Italian slang for lazy person with a small dick. In some areas its used to describe someone unusually skinny pedophilia and I've even heard homosexual. The word has different meaning based on where its said but it all references Italians.
lapp,Lapp,Sami,An old Norwegian name for S�mi that is now considered derogatory. (The S�mi are a people living in Northern Scandinavia)
larrikin,Larrikin,Australians,Not so much an insult; Comical roguish individual prone to rowdy and unruly behaviour (drunkenness). Coined from an Irish policeman in a Melbourne court claiming the prisoner was larkin about. Stereotypical Aussie behaviour.
lassie,Lassie,Whites,Tefers to white people smelling like dogs when they get wet
latifah,Latifah,Blacks,Reference to famous black actor/singer.
latrino,Latrino,Hispanics,Combination of Latino and Latrine.
latte,Latte,Mixed Races,White and usually Mexican due to color of skin being similar to the coffee drink.
latvo,Latvo,Latvians,Shortening of word
lavalamp,Lava Lamp,Hawaiians,Also works on Pacific Islanders or anyone in the volcanic circle.
lavanigger,Lava Nigger,Hawaiians,Hawaii is made up of many volcanoes.
lawnjockey,Lawn Jockey,Blacks,Most all Lawn Jockeys are Black sometimes also known as Porch Monkey. Author Ralph Ellison used the term to describe black people who felt/were treated as if they were speaking on behalf of the black race.
lawnmower,Lawnmower,Mexicans,A large portion of the landscapers are Mexican/Hispanic.
lbd,LBD,Non-Whites,Little Brown Dude. For anyone not white
lbfm,LBFM,Filipinos,Female Filipinos or Asians in general. From 70's military slang stands for Little Brown Fucking Machine
leafblower,Leafblower,Hispanics,Many Hispanics are involved with landscaping and sometimes carry leafblowers
leb/lebbo,Leb/Lebbo,Lebanese,Pretty Self-explanatory. Used a lot in Australia where there was a large arrival of Lebanese immigrants in the mid 80's. Often not derogatory when used.
leche,Leche,Whites,Spanish for milk; color of white skin
lefty,Lefty,Arabs,Thieves in the Arab countries get their hand chopped off.
lemonhead,Lemonhead,Asians,Skin color.
leprechaun,Leprechaun,Irish,From the well-known old Irish myth of the chubby green-clad gnome (what happens when you mix Catholicism with Paganism). Popularized in America by Lucky from the Lucky Charms cereal and St. Patrick's Day.
leprecoon,Leprecoon,Blacks,Combination of Leprechaun and Coon for blacks of Irish descent.
leroy,Leroy,Blacks,A stereotypically black name. Typically used as the name of a character is a racial joke e.g.
leroyrogers,LeRoy Rogers,Blacks,Black cowboys.
levar,Levar,Blacks,Educated blacks. Refers to Levar Burton of Reading Rainbow and Star Trek: The Next Generation fame.
lice,Lice,Whites,Self-explanatory
lice-nester,Lice-Nester,Whites,Whites are known by many to carry and host lice in their hair when they dont keep it clean
lily,Lily,Whites,From the TV Show 'The Jeffersons'
limey,Limey,British,The British Royal Navy supplied a daily ration of lime or lemon juice to their sailors to prevent scurvy.
lincoln'smistake,Lincoln's Mistake,Blacks,US President Abraham Lincoln is known to have freed the slaves.
linthead,Linthead,Whites,Poor working-class whites. Refers to airborne cotton lint in textile plants where low-income whites worked.
lit,Lit,Lithuanians,Shortening of Lithuanian
lithwhack,Lithwhack,Lithuanians,Was used as a nickname for unstable mead-swilling Lithuanians.
little(black)sambo,Little (Black) Sambo,Blacks,As with the Golliwog originated as a relatively benign though mildly offensive characterization and was adapted by other writers to embody many black stereotypes of the time. Currently embodies stereotypes of docility laziness stupidity and disloyalty.
littlebrownbuddy,Little Brown Buddy,Filipinos,FDR referred to them as this.
littlehiroshima,Little Hiroshima,Asians,The United States dropped an atomic bomb on Hiroshima during WW2. The association with the city and asian people in general has stuck. Refers mainly to Japanese.
litvok,Litvok,Lithuanians,Lithuanian Jews. From the Polish word for Lithuania Some Jews do not consider this an insult but ethnic Lithuanians do
liverlips,Liver Lips,Blacks,Self Explanatory
liverlips,Liverlips,Blacks,because it looks like they have liver on thier faces (originates in the southern US)
lobster,Lobster,Whites,White people burn red like lobsters when they spend too long sunbathing.
lobsterback,Lobsterback,British,Redcoats in Revolutionary War.
loby,Loby,Hispanics,Armenian word for beans. Hispanics are known to have a lot of beans in their diet.
locusteater,Locust Eater,Afghans,Locusts are considered to be fine dining in their country they praise allah for about 3 hours if they should be so fortunate as to obtain such a marvelous bounty
lofan,Lofan,Whites,Anglo-Americans. A Chinese word not necessarily derogatory.
lov,Lov,Russians,Many names end in lov
lowlander,Lowlander,Dutch,The Netherlands are below sea level.
lowrider,Lowrider,Hispanics,Refers to lowriders. The tricked out custom cars Hispanic gang members often drive.
lubricano,Lubricano,Mexicans,Variant of greaser.
lucius,Lucius,Blacks,Commonly used on poor black people. During the period prior to the Civil War many blacks were named after famous Romans (e.g. Lucius Marcus Scipio etc.)
lugan,Lugan,Lithuanians,Reasons unknown. Possible origins in the Chicago area.
lugz,Lugz,Blacks,Named after the brand of footwear who's ad campaign is targeted towards blacks.
luigi,Luigi,Italians,Famous Italian videogame plumber. Used to refer to tall thin Italians
lynch-monger,Lynch-monger,Whites,Comes from Whites lynching Blacks before and around US Civil War times.  Monger meaning someone who promotes this practice.
masepoes,Ma Se Poes,Blacks,Comes from the general curse used by Afrikaans-speaking South Africans (mainly coloureds in Cape Town) Jou ma se poes which means Your mother's cunt. Not that common anymore
mac,Mac,Scottish,Common Scottish surname prefix.
macaca,Macaca,Indians,Derived from the word monkey. Famously used by Republican U.S. Senator George Allen during his 2006 re-election campaign.
macaco,Macaco,Brazilians,The Argentinians call Brazilians macacos (monkeys in brazilian portuguese language) because they are more racially mixed. Specially used in soccer confrontations.
macaquito,Macaquito,Brazilians,The Argentinians call Brazilians macaquitos (little monkeys) because they are more racially mixed.
macaroni,Macaroni,Italians,The famous macaroni noodle originated in Italy.
mackerelsnapper,Mackerel Snapper,Irish,It can be applied to any Catholic Irish or otherwise. In the past Catholics were forbidden from eating meat on Fridays. They got around this sort of the same way some vegetarians do by eating fish (although technically this is not vegetarian but pescetarian). Still observed in heavily-Catholic areas (they even have school/church fish-fry Fridays).
maclord,MacLord,Whites,Macintosh users typically caucasians are often haughty and arrogant much like English lords of Olde.
madrasis,Madrasis,Indians,The biggest city in South India used to be called Madras(now Chennai).
maggot,Maggot,Whites,Maggots breed from filth and when the Whites came to America they brought with them rats and diseases therefore wiping out half of the Native American population. Hence the term maggots.
magilagorilla,Magila Gorilla,Blacks,Term for a Huge Fat Black man.
mahout,Mahout,Indians,Literally means Elephant Driver but was turned into a popular racial slur around 1997 when a lot of Indains began to move onto Long Island.
mail-orderbride,Mail-order Bride,Filipinos,The Philippines is one of the biggest sources of mail-order brides.
maize-muncher,Maize-Muncher,Native Americans,Natives are known for there love of corn.
makak,Makak,Moroccan,Makak is some kinda ape. It's a Belgian word.
makaronifresser,Makaronifresser,Italians,German. Fressen is impolite term for eating (people essen but animals fressen).
malabari,Malabari,Malayali/Indian,Popular slang used in the MiddleEast to describe the Malayalam speaking people from Kerala state in India. Malabar which is a part of Kerala used to have economic ties with the MiddleEast because of the spice trade. However the term Malabari is now considered a derogatory word.
malditobori,Maldito Bori,Puerto Ricans,Puerto Ricans come from Boriquen and call themselves Boriquas. Bori is short for that. Maldito is used so commonly before Bori by many other Hispanics because they steal rob kill and smell. Maldito means god-damned.
mammy,Mammy,Blacks,Similar to Aunt Jemima. Stereotype of black women as nannies to white children especially overweight black women - see Gone With The Wind.
mandingo,Mandingo,Blacks,In reference to the 1975 blacksploitation movie with the same name.
mandinka,Mandinka,Blacks,Reference to the motion picture Roots: A Mandinka warrior was a 'Big Black Buck'.
mango,Mango,Hawaiians,Reference to the mongoloid appearance of many Hawaiins and other Pacific islanders.
mangosteen,Mangosteen,Indians,The mangosteen is a fruit that grows in the East Indies and is black on the outside but white on the inside. Refers to Indians who have forgotten their heritage.
mangro-monkey,Mangro-Monkey,Blacks,Monkeys live in mangroves.
manny,Manny,Portuguese,Because it seems nine out of ten Portuguese guys are named Manuel or Manny
manuellabor,Manuel Labor,Mexicans,Mexicans residing in the United States are used predominantly for manual labor. Manuel is a common hispanic name.
mao,Mao,Chinese,From Mao Tse-tung original leader of communist China.
mape,Mape,Canadians,Maple leaf on their flag.
mapleleafnigger,Maple Leaf Nigger,Canadians,Their flag has a maple leaf on it.
maple-sucker,Maple-Sucker,Canadians,Refers to Canadian people and the assumption that they consume lots of maple syrup
mario,Mario,Italians,Famous Italian vidoegame plumber. Used to refer to fat Italians.
maroon,Maroon,Blacks,When the slave ships had a troublemaking slave-to-be they would drop him off on a small island or rock in the middle of the ocean thus 'marooning' him.
marshnigger,Marsh Nigger,Dutch,The Netherlands is a very marshy country
marshmallow,Marshmallow,Whites,A traditional middle-aged caucasian: Soft and White.
marta,MARTA,Blacks,Metro Atlanta Regional Transit Authority. Or as it's sometimes known: Moving Africans Rapidly Through Atlanta.
marthastewart,Martha Stewart,Whites,Means like a bad term for white housewife bored crooked ass homemaker.
mascot,Mascot,Native Americans,Their likeness is often mascots for sports teams
massa,Massa,Whites,Black Southern speech. The Negro slaves addressed their Masters in this way.
matsaleh,Mat Saleh,Whites,Malaysian slur for caucasians.
matza-gobbler,Matza-Gobbler,Jews,Matza is Jewish un-levened bread
matzah,Matzah,Jews,Refers to the Jewish food matzah balls
mavro/mav,Mavro/Mav,Blacks,Greek word for black
mayate,Mayate,Blacks,Hispanic term for 'Nigger.'
mayflower,Mayflower,Whites,American whites. Reference to the ship called Mayflower.
mayonnaise,Mayonnaise,Whites,Skin color.
mcchigger,McChigger,Mixed Races,Irish/Chinese/African American mix
mcgook,McGook,Vietnamese,Soldier in name called them that referring to McDonalds (slaughtered meat)
mckraut,McKraut,Mixed Races,German/Irish person. Used in the Godfather trilogy.
mcnigga,McNigga,Blacks,Reference to McDonald's new line of advertising campaigns marketed towards blacks.
mcnugget,McNugget,Scottish,For scottish or irish children - Mc (or Mac) for scottish/irish nugget to represent that they are children
mcspic,McSpic,Mixed Races,Mixed race of Irish and Hispanics
mcwop,McWop,Mixed Races,Irish/Italian Mick and Wop play on common Irish last names.
md,MD,Whites,Melanin Deficient
mead,Mead,Irish,The Irish are commonly drunk on mead and mead-derived alcohols
meatpie,Meat Pie,Asians,Yellow on the outside black on the inside.
meatball,Meatball,Italians,Self-explanatory
mechanical,Mechanical,Blacks,English rhyming slang - Mechanical digger = Nigger
medwop,Med Wop,Mediterraneans,Self-explanatory.
mehi,Mehi,Mexican,X's (like J's) are pronounced in Spanish like an English H.  Thus this slur is a mockery of their pronounciation.
melanzana,Melanzana,Blacks,Italian for eggplant - very dark black people have a purplish tint to their skin so does eggplant.
mellanoid,Mellanoid,Blacks,Dictionary: one having dark pigmentation.
melonjohnny,Melon Johnny,Blacks,Italian slang for Blacks.
memetis,Memetis,Turks,Greek pronounciation of the Islamic name of Mehmet
memphis,Memphis,Whites,Dirty white trailor trash people normally resemble the population of Memphis TN.
merkin,Merkin,Americans,American pronunciation of American also a pubic wig
meshback,Meshback,Whites,For Rednecks. Refers to the mesh-backed caps they wear
meshky,Meshky,Blacks,Translated into Farsi (Persian language) means black. Used commonly among young white boys as undercover means of saying nigger
mestizo,Mestizo,Hispanics,Specifically Spanish/Native American mixed breed. Not polite but not taboo either. From the Spanish word for mixed.
mexcrement,Mexcrement,Mexicans,Obvious combination of Mexican and excrement
mexi-ho's,Mexi-Ho's,Mexicans,Term to describe Mexican girls who get pregnant at an early age.
mexican't,Mexican't,Mexicans,Based on the stereotype that Mexicans are lazy.
mexicoon,Mexicoon,Mixed Races,Mexican/Black mix.
mexijew,Mexijew,Mixed Races,Mexican/Jewish mix.
meximese,Meximese,Mixed Races,Mexican/Vietnamese
midang,Mi Dang,Blacks,The Vietnamese term for African Americans.
michelli,Michelli,Whites,Commonly used to refer to Whites living in southern United States.
mick/mic/mc,Mick/Mic/Mc,Irish,Many Irish surnames begin with Mc or Mac. Many Irish are also named after the famed Michael Collins making Michael (Mick) a very common name. Not as derogatory as Paddy.
midnight,Midnight,Blacks,Self-explanatory.
migger,Migger,Mexicans,Mexicans/Hispanics who act black.
miguel,Miguel,Mexicans,Stereotypical name for Mexicans
milano,Milano,Mixed Races,Black/White mix. In reference to the cookie.
milk,Milk,Whites,Due to the light color of their skin
milkdud,Milk Dud,Blacks,A black person with a shaved head.
milkhead,Milkhead,Whites,Very white with a big head.  Can be heard in John Waters' Female Trouble
milkman,Milkman,Blacks,Black men who prefer white women. Used by blacks.
milky,Milky,Whites,Referring to their racism and white skin.
mingia,Mingia,Italians,In Sicilian dialect it means 'dick'.
mishwa,Mishwa,Blacks,Means barbequed or grilled in Arabic blacks for their dark skin. Mishweya for females.
misscleo,Miss Cleo,Blacks,A reference to the (in)famous commercial personality.
missingtooth,Missing Tooth,Whites,Redneck whites commonly have missing teeth.
missippitreeemblem,Missippi Tree Emblem,Blacks,Due to when they were hung in the Southern states.
mississippibluelip,Mississippi Blue Lip,Blacks,Old redneck term.
mistercharles,Mister Charles,Vietnamese,Used during the vietnam war referring to VC or Victor Charlie.
mistercharlie,Mister Charlie,Whites,Lying Conniving Untrustworthy white
miyagi,Miyagi,Asians,From the movie The Karate Kid
miyate,Miyate,Blacks,Mexican/Latino slang for minority.
mlk,MLK,Blacks,Pronouced milk made due to misrepresentation of national holidays
mo,Mo,Mexicans,Acronym for Mexican Orderly: Used in jails to refer to mexican trustees.
mo,Mo,Eskimos,Shortened version of Eskimo
moandyo,Mo And Yo,Blacks,2 of the more common sounds they make in their general street slang.
moanback,Moanback,Blacks,From Southern black garbage men giving the driver directions on when to back up (Come on back or 'mon back).
mob,MOB,Americans,Morbidly Obese Bodies on account of Americans are mostly fat (also could be Morbidly Obese Bitches for women)
mocha,Mocha,Arabs,Skin color (not quite black).
mockey,Mockey,Jews,Jews mocked Jesus at his death.
mocro,Mocro,Moroccans,Used by themselves and the Dutch. Originated from Spanish
modernfarmequipment,Modern Farm Equipment,Mexicans,Many Mexicans work in agriculture today.  Evolved from the Antique Farm Equipment slur for Blacks.
moe,Moe,Chinese,Since Chinese always have haircuts that look like Moe from The 3 Stooges
mof/moffen,Mof/Moffen,Germans,Used by the Dutch in the 2nd World War.
mohow,Mohow,Native Americans,Indians have Mohawks & Pow wows.
mojack,Mojack,Icelandics,Military term for Icelandics origin unknown [?]
mojado,Mojado,Hispanics,Means 'wet' or 'dunked' in Spanish. See Mojo
mojo,Mojo,Hispanics,Normally used among Hispanics towards other Hispanics. Mojo derives from mojado meaning wet i.e. wet-backs. Mojados are Mexican citizens while pochos are Mexican-Americans.
moke,Moke,Hawaiians,Refers to how locals in Hawaii are big/fat/dumb. Used by locals similar to how blacks use nigger.
moleckojecko,Molecko Jecko,Egyptians,A term used for an Epygtian young male in America. Molecko Jecko was a character in a comedy who used to come to America just to buy a lifetime supply of milkshakes. Comes from the word Moleckum meaning drink sipper in Arabic.
monday,Monday,Blacks,Nobody likes Mondays.
mongrel,Mongrel,Mixed Races,When dogs of two different breeds breed. The offspring is called a mongrel breed
monkey,Monkey,Blacks,Similar appearance/genetics.
monkeyboy,Monkeyboy,Blacks,People once believed because of their high cranium blacks were close cousins to primates.
mono,Mono,Blacks,A hispanic term for blacks meaning monkey in most dialects.
montana,Montana,Hispanics,Derived from the movie Scarface which stars a cuban immigrant druglord named Tony Montana slur usually said with a Spanish accent
montu,Montu,Blacks,Old African word that refers to tribes people.
mook,Mook,Chinese,A 'mook jonk' is a wooden dummy used in kung fu. Word defined as an ineffectual foolish or contemptible person.
mooliachi,Mooliachi,Blacks,Female version of Mooley. Used in The Godfather.
moolie,Moolie,Blacks,Shortened from Melanzane meaning eggplant in Italian. Eggplants have black skin.
moolignon,Moolignon,Blacks,Italian for eggplant (technically Mulignane). Could be combination of Moolie and hooligan.
mooncricket,Moon Cricket,Blacks,See Cricket. Possibly derived from the MC often used after many black nicknames. Also a possible reference to the minoral aspect of the African race in the United States. A black person(cricket) in a sea of white(the moon).
mooncricket,Moon Cricket,Whites,The slur is also used by some Native Americans against whites: moon as in pale and cricket as in whites have big eyes and gangly legs. Whites also make annoying sounds like crickets.
moor,Moor,Arabs,For the Muslims that invaded Europe during the Middle Ages. Also used as derogatory against those of ancestry where the Moors settled (Spain Sicily) - they are part Moor.
moose,Moose,Koreans,Used by American GIs to refer to Korean whores because of their facial features.
moosefucker,Moosefucker,Canadians,Tom Green a Canadian mocked sexual contact with a moose on his television show.
moron,Moron,Mormons,Similiar words
mortacristo,Morta Cristo,Jews,Italian for 'Christ-killer.'
moses,Moses,Jews,Famous Jew who led his people out of Egypt.
moskal,Moskal,Russians,Used by Ukrainians because of the arrogance of the Moscow citizens
mosquito,Mosquito,Muslims,Reference to Muslims going to mosques.
mosquito,Mosquito,Jews,Jews tend have long noses similar to a mosquito.
mosseater,Moss Eater,Whites,White trash in the Pacific Northwest.
mottisa,Mottisa,Blacks,Back in slave days the Black servants would ask Mo tee Sah which in proper English translates to More tea Sir?
mountainmonkey,Mountain Monkey,Norwegians,Danish slur for Norwegians.  Frequently used at sporting events.
mouse,Mouse,Whites,Used by Blacks to refer to nervous (shook) white people walking through the ghetto.
mow-mow,Mow-Mow,Blacks,Refers to the Mau Mau movement in Kenya  that rose up in protest to the theft of their land by the British. Mau Mau is european-invented name; the Gikuyu people is the Kenyan name.
mozzie,Mozzie,Muslims,Shortend term
mr.big,Mr. Big,Blacks,From Yaphet Kotto's Character in the Bond film Live and Let Die.
mr.bojangles,Mr. Bojangles,Blacks,William Bojangles Robinson was a famous black dancer.
msgfarmers,MSG Farmers,Chinese,The Chinese use a harmful additive M.S.G. in their food to enhance the flavor.
muck,Muck,Eskimos,Short for Eskimuck due to the problems the Eskimo have pronouncing the English language.
muck,Muck,Native Americans,Short for Muckleshoot one of the most stereotypical and despised tribes of the Pacific Northwest
muckadoo,Muckadoo,Blacks,Shawnee Native American term for Mud person
mucker,Mucker,Irish,Used in Boston because Irish immigrants could mostly only find employment helping to fill in the Back Bay which was at the time marsh and water.
mud,Mud,Mixed Races,Black/White mix or white women who date black men
mudduck,Mud Duck,Blacks,Dark skin. See Mud People.
mudflaps,Mud Flaps,Blacks,Black people who have large lips.
mudpeople,Mud People,Blacks,Sentiment that only Wasps are born with souls everyone else God made from mud. Also suggests life without meaning value or worth. Used by the church that was attended by Mr. Smith - the hate killer that shot up a bunch of Jews and Blacks in the summer of '99.
mudshark,Mud Shark,Whites,White girls who date black men.
mudturtle,Mud Turtle,Blacks,Being bottom-feeders; Mud musk turtles have a distinct odor and are mud-colored
mudak,Mudak,Russians,Similar to dumb ass but very explicit.
mudskipper,Mudskipper,Whites,A white woman who dates black men.
mudslide,Mudslide,Mexicans,What a jailbreak of Mexicans looks like.
mufasa,Mufasa,Blacks,James Earl Jones' character from The Lion King.
muffin-head,Muffin-head,Blacks,Reference to the popular black hair style of afro's.
muhammad,Muhammad,Arabs,Common name.
muk/muktuk,Muk/Muktuk,Eskimos,Comes from the main Eskimo food source - Muktuk - whale fat/meat.
muktuk,Muktuk,Eskimos,Muktuk is eskimo for whale blubber
mulan,Mulan,Chinese,Female charater in a chinese story
mule,Mule,Hispanics,Hispanics transport drugs.
mullato,Mullato,Mixed Races,Black/White mix usually. The Spanish Mullato translates to like a mule. Could refer to any mixed breed.
mulletard,Mulletard,Whites,Retarded white trash with a mullet.
mullethead,Mullethead,Whites,Bad hair cut (short on top long in back) rural whites sport fashionably. Could easily be shortened to just mullet.
mulunyan,Mulunyan,Blacks,Italian word for egg plant which is black when uncooked.
mung,Mung,Vietnamese,Vietnamese people that were relocated to America by the US government during and after the Vietnam War. It's actually the correct pronunciation of the word Hmong mountain-dwelling people inhabiting southeastern China and the northern parts of Vietnam Laos and Thailand. Also used derisively to apply to all Asian persons. Also a type of bean/bean sprout used in oriental cuisine.
mungen,Mungen,Chinese,A Tamil word used by the Indians to insult the Chinese
mungiecake,Mungie Cake,Whites,White sponge cake found in Europe.
munt,Munt,Blacks,Rhodesian. Comes from the African word for person
mupp,Mupp,Whites,Refers to white people who are as filthy as a mop.
muppetfucker,Muppetfucker,Whites,Backwoods inbred rednecks of the U.S. south are called muppetfuckers because they look like Muppets.
murray,Murray,Maori,Sounds similar to Māori New Zealand aboriginals.
mushu,Mushu,Asians,Probably from Asian kid on Crank Yankers
musungu,Musungu,Whites,Swahili word for white people
mutt,Mutt,Mixed Races,Any mix of races. The regular use of 'mutt' refers to dogs of mixed breed.
muzzie,Muzzie,Arabs,A lot of Arabs are Muslims. Muslim Muzzie.
myfriend!,My Friend!,Indians,Started by the constant greetings of the clerks of a deli as they greet customers.
mythmaker,Mythmaker,Greeks,Because the Greeks made up myths
n'er,N'er,Blacks,Nonchalant way of saying nigger.
n.e.d.,N.E.D.,Scottish,Non Educated Delinquent.  A major subculture in Scotland NEDs are young criminal men who live off government handouts.
n.l.b.,N.L.B.,Whites,Nigger Loving Bitch. Represents a woman while not of the African race sleeps with those who are.
naca,Naca,Blacks,North American Concrete Ape
nacho,Nacho,Hispanics,Based on the popular snack.
naco,Naco,Hispanics,Native Mexicans. Used as an insult by city dwellers on indigenous small town inhabitants or vulgar people even from the big city.
nade,Nade,Canadians,Shortened form of Canadian. Nades is a 2v1 game of tennis.
naffer,Naffer,Arabs,Naf short for North-African
naga,NAGA,Blacks,North American Ground Ape; Affectionately used by the LAPD during the Watts riot in Los Angeles.
nagasaki,Nagasaki,Japanese,Self explanatory
nagur,Nagur,Blacks,The Irish-Americans called black people Nagurs because they could not pronounce the word Nigger with their accent.
naha,NAHA,Blacks,North American Hairless Apes
nammer,Nammer,Vietnamese,Derived from Vietnam being called Nam.
nanner,Nanner,Blacks,Banana/Monkey/etc related. Also a way to mask the word Nigger
nanner,Nanner,Afghans,Nann is the main bread that Afghans eat.
napa,NAPA,Blacks,Nother American Pavement Apes.
napalm,Napalm,Vietnamese,Napalm was used during the Vietnam war.
napkinnigger,Napkin Nigger,Indians,Obvious reasons.
nappyhead,Nappy Head,Blacks,Refers to hair type.
